news_media	news_posttime	news_url	app_name	news_digest	tag
web	2019-10-14 16:51:00	http://baijiahao.baidu.com/s?id=164735805318102115	小路侠	小路侠吧专注个人成长，一点追求二两侠骨现在问：你玩抖音吗？和以前问：你微信多少？的人一样多。抖音已经	
app	2019-10-14 14:58:04	http://www.toutiao.com/item/6747549463360832012	昆明检察	新华社北京10月11日电十三届全国政协第28次双周协商座谈会11日在京召开。中共中央政治局常委、全国	
weibo	2019-10-14 00:17:36	http://weibo.com/2088808343/IbmG4lh0m?refer_flag=1	雨中的躯壳_4c		
app	2019-10-14 21:25:45	http://www.toutiao.com/item/6747649368469307908	威海市中级人民法院	中共威海市中级人民法院党组关于公开征求主题教育意见建议的公告关于征求“不忘初心、牢记使命”主题教育意	
wx	2019-10-15 10:02:00	http://mp.weixin.qq.com/s?__biz=MzA5ODQ5MTkxMg==&m	海南环保	"平均海拔4058米,高寒缺氧,发展滞后,脱贫攻坚“拔穷根”,在这里注定是“硬仗中的硬仗”;三江之源,"	
web	2019-10-14 21:31:15	http://www.comnews.cn/article/pnews/201910/2019100	中国商务新闻网	——２０１９中国国际数字经济博览会观察新华社石家庄１０月１４日电眼前的一面镜子成为常伴身边的“保健医	
web	2019-10-14 11:29:00	http://news.ruc.edu.cn/archives/257740	中国人民大学	习近平同志一贯重视马克思主义政治经济学的学习和运用，作出了“要坚持中国特色社会主义政治经济学的重大原	
app	2019-10-14 08:42:00	https://emcreative.eastmoney.com/Fortune/V/Share_A	东方财富	本周要闻解读:有哪些消息面会影响黄金走势？投资者该如何判断？今日，投资者需要警惕周末有关贸易局势进展	
web	2019-10-16 18:06:23	http://www.citnews.com.cn/citnews/roll/201910/1036	中文科技资讯	“自从产品上了网，销路越来越宽广。”四川阿坝藏族羌族自治州松潘县一家沙棘果汁工厂老板庞旺孝，尝到了“	
app	2019-10-15 10:03:36	https://c.m.163.com/news/a/ERH6SF5C075297TC.html	网易新闻	“人民对美好生活的向往就是我们的奋斗目标”，住有所居是美好生活的基石，是我们党执政兴国矢志不渝的追求	
wx	2019-10-15 12:50:14	http://mp.weixin.qq.com/s?__biz=Mzg2NDI0ODMzOA==&m	最毒负人心	"阅读本文前,请您先点击上面的“蓝色字体”,再点击“关注公众号”,这样您就可以继续免费收到最新文章了,"	
app	2019-10-14 12:20:32	http://www.toutiao.com/item/6747508867640328715	中国能源报	中国能建举办“初心能见·庆祝新中国成立70周年”座谈会，人民日报社副总编辑方江山出席会议并发言9月2	
web	2019-10-14 10:46:36	http://www.yanshan.gov.cn/publicity/zcwj/3884	砚山县人民政府门户网站	各乡人民政府，县直有关部门：已经县人民政府同意，现印发给你们，请认真组织实施。???????????	
wx	2019-10-14 14:29:24	http://mp.weixin.qq.com/s?__biz=MzU5NDAxODIyNw==&m	重庆民革	"在创建新中国、人民政协伟大事业的进程中,民革作为中国共产党领导的统一战线和多党合作中的一员,作为致力"	
wx	2019-10-16 16:06:54	http://mp.weixin.qq.com/s?__biz=MzAwNjUyNDE4MQ==&m	三井街道飞龙社区居民委员会	"习近平关于“不忘初心、牢记使命”论述摘编是全党开展“不忘初心、牢记使命”主题教育的重要学习材料,对于"	
web	2019-10-16 10:45:00	http://sh.people.com.cn/n2/2019/1016/c134768-33441	人民网	扫码、拍照、评判、上传……这一连串的动作并不是网上点评，而是北蔡镇杨桥村的保洁员孙师傅每天挨家挨户收	
web	2019-10-14 09:26:00	http://caipiao.people.com.cn/n1/2019/1014/c373276-	人民网	9月29日晚，中国福利彩票双色球第2019114期开奖，开出的中奖号码为：红球02、04、09、11	
wx	2019-10-15 15:54:48	http://mp.weixin.qq.com/s?__biz=MzA3MjU4NzkwOQ==&m	四川文艺网	"四川省新文艺群体发展成果展宣传片10月11日,由中共四川省委宣传部、四川省委统战部指导,四川省文学艺"	
web	2019-10-14 12:52:00	http://www.htsslt.com/html/20191014/11429.html	俄罗斯世界杯盘口	新华社记者“脱贫攻坚本来就是一场硬仗，而深度贫困地区脱贫攻坚是这场硬仗中的硬仗。我们务必深刻认识深度	
web	2019-10-14 07:23:00	http://news.cctv.com/2019/10/14/ARTI9qn0nAp6A3dq15	央视国际	央视网消息：每天8点，央视网为您梳理24小时内发生在咱们身边的大小事儿。●14日，国务院新闻办公室将	
web	2019-10-14 06:59:00	http://news.kf.cn/2019/1014/409884.shtml	开封网	全媒体记者叶森马燕报道10月10日至12日，新华社河南分社社长王丁带领全媒体采访组来汴调研，深度聚焦	
wx	2019-10-14 06:00:00	http://mp.weixin.qq.com/s?__biz=MzU5MTYxNDQzMQ==&m	爱上睡前听	"一定别再吃三七了因为只要吃了,你会发现你嫌弃其他保养身体产品了,三七是唯.一可以长期服用吃的药食同源"	
app	2019-10-15 10:16:45	http://www.yidianzixun.com/article/0NTupYtk	云南省人民检察院	新华社西宁10月14日电中共中央政治局委员、中组部部长陈希13日在青海调研“不忘初心、牢记使命”主题	
web	2019-10-14 01:38:00	http://www.sohu.com/a/346787798_115402	新华网	新华社重庆10月13日电13日晚，中国国奥队战平沙特队，此次重庆国际足球锦标赛的三场比赛均零封对手。	
wx	2019-10-14 05:20:00	http://mp.weixin.qq.com/s?__biz=MzI3MTMzOTA0Mg==&m	亲人健康	10月1日上午庆祝中华人民共和国成立70周年大会在北京天安门广场隆重举行习近平乘坐检阅车检阅部队阅兵	
wx	2019-10-14 18:09:17	http://mp.weixin.qq.com/s?__biz=MzI1MjUzODY4Ng==&m	安化发布	学习进行时在河南考察调研、视察北京香山革命纪念地、主持中央政治局会议、主持中央政治局集体学习、主持召	
web	2019-10-14 09:06:34	http://www.sohu.com/a/346821879_114731	人民网	人民网长沙10月13日电“中医药专长绝技是具有独特的中医药特色和确切疗效，但目前在中医药文献中没有记	
web	2019-10-14 06:28:00	http://baijiahao.baidu.com/s?id=164731889850502479	大众日报	2019年10月11日至13日，国家主席习近平应邀赴印度出席中印领导人第二次非正式会晤、对尼泊尔进行	
web	2019-10-14 17:57:00	http://www.gxgg.gov.cn/gdtt/20191014-2206903.shtml	中国贵港人民政府门户网站	打印10月10日，市委“不忘初心、牢记使命”主题教育领导小组办公室、巡回指导组第三次会议在市区召开。	
app	2019-10-15 00:33:35	http://m.news.liebao.cn/detail.html?newsid=V9qmFT_	猎豹浏览器	"“海南要高举改革开放旗帜,创新思路、凝聚力量、突出特色、增创优势,努力成为新时代全面深化改革开放的新"	
web	2019-10-14 17:49:18	http://www.liaozhong.gov.cn/czgz/201910/t20191014_	辽中区人民政府	为进一步推进扫黑除恶专项斗争工作，严厉打击各类涉黑涉恶违法犯罪，维护社会稳定。10月12日上午，杨士	
web	2019-10-14 10:08:45	http://k.sina.com.cn/article_2286908003_884f726302	人民网	新华社长春10月13日电10月12日至13日，中宣部在吉林省长春市召开学习宣传贯彻习近平新时代中国特	
web	2019-10-16 16:44:40	http://www.gzwd.gov.cn/xwzx/xzsqdt/201910/t2019101	乌当区人民政府	2019年10月15日，新堡布依族乡组织召开“不忘初心、牢记使命”主题教育专项整治漠视侵害群众利益问	
web	2019-10-14 08:40:58	http://www.hbgd.net/html/szyw/20191014/16282.html	河北广电网	十月十三日，国家主席习近平在加德满都同尼泊尔总理奥利会谈。新华社记者鞠鹏摄本报加德满都10月13日电	
web	2019-10-14 07:07:00	http://news.nen.com.cn/system/2019/10/14/020936311	东北新闻网	央视网消息：国家主席习近平当地时间12日在加德满都总统府会见尼泊尔总统班达里。两国元首共同宣布，双方	
app	2019-10-14 19:34:50	https://ishare.ifeng.com/c/s/v002WHt7rntEqt0--fSrK	凤凰新闻	俄罗斯总统普京14日访问沙特阿拉伯，与沙特领导人讨论双边合作以及地区热点问题。分析人士指出，普京时隔	
web	2019-10-14 11:17:28	https://www.kunming.cn/news/c/2019-10-14/12741294.	昆明信息港	国庆七天长假刚刚结束，庆祝新中国成立70周年的欢歌笑语仍在大地上回响。假日期间，人们阖家出游、观赏烟	
web	2019-10-15 10:10:00	http://www.changting.gov.cn/xwzx/ctxw/201910/t2019	长汀县人民政府网站	国庆前夕，长汀县全体在家县领导围绕“严明纪律规矩”专题，就如何“清正廉洁作表率”开展集中学习研讨，这	
app	2019-10-14 11:32:00	http://a.mp.uc.cn/article.html?uc_param_str=&from=	河北新闻网	央视网消息10月20日至22日，第六届世界互联网大会将在乌镇召开，全球互联网将又一次进入乌镇时间。连	
forum	2019-10-14 12:08:59	http://www.yyqyy.com/read.php?tid=4278452	羊城论坛	"据新加坡联合早报等多家外媒报道,看主旋律电影成为许多中国人度过今年国庆假期的方式,“最红国庆档”引发"	
wx	2019-10-14 13:43:48	http://mp.weixin.qq.com/s?__biz=Mzg3ODAxOTIxNQ==&m	晋情事	"一转眼,中国男篮距离世界杯的第一场比赛只有30天的时间了,在过去一个月中国男篮经历了三个阶段的备战,"	
web	2019-10-14 17:14:00	http://www.njdaily.cn/2019/1014/1803243.shtml	南报网	-->新华社北京10月14日电题：“3秒一刷”在医院官方平台抢票，“号贩子”转战网络如此猖獗！随着网	
app	2019-10-14 10:37:19	https://c.m.163.com/news/a/EREMDG1C0514CKH1.html	中国政府网	10月13日晚，国家主席习近平在结束同印度总理莫迪第二次非正式会晤和对尼泊尔国事访问后，回到北京。中	
web	2019-10-14 10:31:00	http://www.qhnews.com/newscenter/system/2019/10/14	青海新闻网	透过10月10日至11日在华盛顿举行的新一轮中美经贸高级别磋商，能够感触当前中美经贸关系发展之脉。中	
wx	2019-10-14 17:40:12	http://mp.weixin.qq.com/s?__biz=MzI0NzM2NzA4OA==&m	浙江省投融资协会ZJIFA	投融日报InvestmentAndFinanceDaily▉赢的四条原则:认识到强烈的使命感和切实的	
web	2019-10-14 12:41:00	http://www.jsw.com.cn/2019/1014/1510885.shtml	金山网	新华社北京10月13日电离第七届世界军人运动会拉开战幕越来越近了，从报名参赛的各国运动员名单来看，可	
web	2019-10-14 17:55:08	http://www.yicheng.gov.cn/contents/3399/405420.htm	翼城县人民政府	新华社北京10月14日电据商务部消息，为推动落实习近平主席访问太平洋岛国和菲律宾的重要务实合作成果，	
web	2019-10-15 02:11:39	http://www.apio2010.org/qiwen/107406.html	中搜网	发现湘西本市哪里有私家(侦探联系方式详情湘西市侦探公司热线：李经理，律师推荐湘西本地最专业、信誉最好	
web	2019-10-14 10:31:47	http://www.sohu.com/a/346842114_100143231	神州杂志资讯	躺在家里，就能享受星级酒店的SPA护理；足不出户，就能体验到一站式美甲、美睫服务……在“十一”黄金周	
app	2019-10-14 08:48:56	http://k.sina.cn/article_2087169013_7c67abf501900q	法制日报	突然被这个热搜吓了一跳，#身份证丢3年后负债200万#，这简直就是个天文数字！有人问，难道身份证丢了	
web	2019-10-15 23:52:00	http://www.htsslt.com/html/20191016/61376.html	俄罗斯世界杯盘口	新华社记者“脱贫攻坚本来就是一场硬仗，而深度贫困地区脱贫攻坚是这场硬仗中的硬仗。我们务必深刻认识深度	
wx	2019-10-14 17:42:09	http://mp.weixin.qq.com/s?__biz=MzIwMzgzMDA5Nw==&m	镇青飞扬	"新华社北京10月13日电在中国少年先锋队建队70周年之际,中共中央总书记、国家主席、中央军委主席习近"	
web	2019-10-15 09:08:00	http://baijiahao.baidu.com/s?id=164741987372541002	人民网	53岁的何兰花是湖南省邵阳县白仓镇鸟语村村民。因为双肾结石曾做过手术，2015年11月她被确诊为尿毒	
app	2019-10-14 01:16:07	https://k.sina.cn/article_2107036715_7d96d42b01900	黄三角早报-东营	近期，国家市场监管总局发布情况通告，在对粮食加工品、淀粉及淀粉制品、蜂产品等8大类食品867批次样品	
web	2019-10-14 16:42:27	http://www.hp.gov.cn/hp/hpj/201910/f10d7430d42843f	广州市黄埔区人民政府	????据南岗街主题教育工作统一安排，南岗街党工委书记田农带头学习），并于10月11日下午，以“着眼	
web	2019-10-16 01:36:48	http://www.zgdtcy.com/icsoo/cqaa094.html	低碳产业网	这段时间，颍上县扶贫专班指挥部每天晚上八点多都要开一次会商会，会上对进驻各乡镇扶贫专班汇总报上来的问	
wx	2019-10-14 19:17:21	http://mp.weixin.qq.com/s?__biz=MzA5MjY3MDEwNA==&m	龙岗发布	"近期,市场监管总局发布情况通告在对粮食加工品、淀粉及淀粉制品、蜂产品等8大类食品867批次样品的抽检"	
wx	2019-10-15 09:10:00	http://mp.weixin.qq.com/s?__biz=MzA5Njk5MDM1Ng==&m	艺术阵地	"小时候一生病妈妈总会端着一杯热腾腾的奶告诉我“赶紧喝,喝了好得快”现在才知道万病之源是免疫力下降负责"	
wx	2019-10-14 08:31:41	http://mp.weixin.qq.com/s?__biz=MzI4MzEwMjczNg==&m	宿青平雕塑艺术	"临汾警校参观红色雕塑2019年10月12日,临汾警察学校党委组织各支部参观古城公园雕塑馆由市委宣传部"	
wx	2019-10-14 08:48:04	http://mp.weixin.qq.com/s?__biz=MzU3NjQyMTQxNg==&m	金时资管	"1014主题前瞻1、氢能源新华社13日报道,中南大学刘小鹤教授团队在廉价电催化材料领域取得了系列进展"	
app	2019-10-14 14:29:53	https://kuaibao.qq.com/s/20191014A0CROS00	舟山广电	喜讯！舟山被评为“全国绿化模范城市”！是我省此次唯一获表彰的设区市！全国绿化委员会近日在第13版人民	
app	2019-10-14 08:44:00	http://3g.k.sohu.com/t/n399474666	搜狐新闻	地点：从北京出发，先赴金奈，后抵加德满都。行程安排：出席中印领导人第二次非正式会晤并对尼泊尔进行国事	
app	2019-10-14 18:30:52	http://www.toutiao.com/item/6747604302484734472	中国财富网	传媒板块领涨两市机构分析称五因素助推四季度行情上扬中国财富网讯10月14日，传媒板块迎来回暖，截至收	
web	2019-10-14 10:15:10	http://www.mlx.gov.cn/kzw/gwyxx/861474.htm	木垒县人民政府	新华社北京10月14日电据商务部消息，为推动落实习近平主席访问太平洋岛国和菲律宾的重要务实合作成果，	
wx	2019-10-14 17:30:00	http://mp.weixin.qq.com/s?__biz=MjM5MzE0NTgxMQ==&m	优志愿	"据无锡市人民政府新闻办公室官方微博发布的消息,10月10日18时10分许,312国道K135处、锡港"	
app	2019-10-14 11:53:20	http://m.news.liebao.cn/detail.html?newsid=Ll3IWH1	猎豹浏览器	大潮起珠江，弄潮正当时。这里是唱响春天故事的地方，是改革开放的前沿阵地，是我国开放程度最高、经济活力	
app	2019-10-15 18:22:08	http://www.toutiao.com/item/6747973136991388174	北京市人民检察院	强化政治担当使命担当责任担当不断推动扫黑除恶专项斗争取得新成效文章来源检察日报赵克志在全国扫黑除恶专	
web	2019-10-15 10:03:00	http://www.e0734.com/html/2019/1015/906707.html	中国衡阳新闻网站	新华社北京10月14日电一分钟的工夫，有多少商品出入中国国门？14日，最新答案揭晓：将近5900万元	
app	2019-10-15 00:13:18	http://www.toutiao.com/item/6747692543963578891	中国网	韩国法务部长官宣布辞职新华社首尔10月14日电韩国法务部长官曹国14日宣布将辞去长官职务，并对国民道	
app	2019-10-14 08:21:00	http://view.inews.qq.com/a/20191014A04AXZ00	人民网国际	近日，中国国家主席习近平对尼泊尔进行国事访问。这是中国国家主席时隔23年再次访尼，具有重要历史意义。	
wx	2019-10-14 11:56:30	http://mp.weixin.qq.com/s?__biz=MzAwNTIyNzUzNw==&m	淘自然旅行	#南麂岛#看海听涛丨夏日物语中国十大最美海岛之一沙特别细海水特别蓝海鲜又好又多又便宜草坪海岛草坪难得	
web	2019-10-14 00:59:00	http://www.shishi.gov.cn/zwgk/xwzx/jrss/201910/t20	石狮市人民政府	新华社加德满都10月13日电国家主席习近平13日在加德满都同尼泊尔总理奥利会谈。习近平指出，中尼历来	
web	2019-10-14 08:35:00	http://news.cctv.com/2019/10/14/ARTI0uoMW1LAJdObMR	央视国际	联播+“全党全社会要重视少先队工作。”在中国少年先锋队建队70周年之际，习近平总书记以致信的形式，再	
web	2019-10-15 03:05:18	http://www.zgdtcy.com/yxrox/moiqm124.html	低碳产业网	去年11月，经省政府同意，要求，各地2016年底前，制定出台本辖区禁养区内畜禽规模养殖场关闭搬迁方案	
web	2019-10-14 10:48:42	http://dy.163.com/v2/article/detail/EREN2A2Q05342W	成都市新都区人民检察院	近日，江苏省消保委对7家智能电视企业进行约谈，督促其就商业性开机广告强行植入限时整改。调查发现，10	
web	2019-10-14 09:11:55	http://k.sina.com.cn/article_2286908003_884f726302	人民网	新华社北京10月13日电离第七届世界军人运动会拉开战幕越来越近了，从报名参赛的各国运动员名单来看，可	
app	2019-10-14 22:31:43	https://kuaibao.qq.com/s/20191014A0QVV000	政知见	撰文余晖被带走4个月后，西安市公安局副局长、市公安局扫黑办主任阎鸿被证实是“警伞”！政知见注意到，1	
web	2019-10-15 07:57:51	http://www.poyang.gov.cn/news-show-12725.html	鄱阳县人民政府	10月9日上午，县十六届人民政府第46次常务会议在县政府四楼常务会议室召开。县委副书记、县长胡斌主持	
wx	2019-10-15 06:04:36	http://mp.weixin.qq.com/s?__biz=MzUxNTY3NTgwMQ==&m	聆听动人歌曲	"一个42岁的女人,正常人被叫老阿姨的年纪,竟然在3个月的时间里逐渐“返老还童”?!是什么原因让她变化"	
web	2019-10-14 08:53:00	http://www.dt.gov.cn/dtzww/gwy/201910/768e85514bda	大同市人民政府	"两国元首共同宣布建立中尼面向发展与繁荣的世代友好的战略合作伙伴关系10月12日,国家主席习近平在加德"	
wx	2019-10-14 00:01:00	http://mp.weixin.qq.com/s?__biz=MzI5MTYzMjMwNA==&m	历史茶话社	"点击蓝字关注“历史茶话社”每年高考都会涌出一大批“高考状元”,他们先后步入政界、商界、学界,成为社会"	
web	2019-10-15 10:00:56	https://k.sina.com.cn/article_2341087142_8b8a27a60	中国江西网	新华社德国斯图加特10月14日电“零金”收官，奖牌榜名列第八。中国体操队在斯图加特世锦赛黯然离场。连	
wx	2019-10-14 11:41:08	http://mp.weixin.qq.com/s?__biz=MzI1NzY0MjM2Ng==&m	突泉在线	"在电商网站上只要花几元钱,就能给朋友圈来一次“精装修”,打造各种“高端人设”。近日,记者调查发现,用"	
app	2019-10-14 12:36:00	http://mini.eastday.com/app/191014123600215.html	人民网	人民网梧州10月12日电第二批“不忘初心、牢记使命”主题教育启动以来，南方电网广西梧州供电局结合工作	
wx	2019-10-14 06:00:00	http://mp.weixin.qq.com/s?__biz=MzU1MjkzNTM1Nw==&m	法律学术前沿	"合作链接:中国行为法学会培训中心将在全国建立律所基地,打造律所课堂!在眼下连续高温的省城,济南市排名"	
wx	2019-10-15 18:07:34	http://mp.weixin.qq.com/s?__biz=MjM5Njc0MDg1OQ==&m	陇南统战	在黄河流域生态保护和高质量发展座谈会上的讲话习近平黄河是中华民族的母亲河。我一直很关心黄河流域的生态	
web	2019-10-15 09:50:58	http://www.zgdtcy.com/0w1/ewp313.html	低碳产业网	没过多久，该网友给她介绍了一个“金融盘”项目――澳融新游。“也担心过会上当受骗，所以当时就没答应注册	
web	2019-10-14 16:28:00	http://www.81.cn/gnxw/2019-10/14/content_9651169.h	中国军网	首先，中美新一轮经贸高级别磋商取得实质性进展，缓解了双方的贸易战紧张，再次燃起了两国公众及国际社会对	
web	2019-10-14 08:00:00	http://www.sohu.com/a/346834679_262340	人民网-军事频道	“抗日战争的胡家铺战斗中，排长刘开芝用这把大刀以一敌三、浴血杀敌”“解放战争中，战士刘二虎身上多处中	
app	2019-10-14 11:24:11	http://view.inews.qq.com/a/20191014A087MF00	网连中国	备受网友关注的“李心草溺亡”事件有了新的进展。10月13日下午，警方向记者公开了事发地酒吧内3个多小	
web	2019-10-14 09:30:25	http://tv.people.com.cn/n1/2019/1014/c141029-31398	人民网	习近平结束同印度总理第二次非正式会晤和对尼泊尔国事访问回到北京	
app	2019-10-14 09:09:16	https://c.m.163.com/news/a/EREHARDL0516BIKO.html	HR圈内招聘网	网络直播无疑是近两年的风口之一，我们见过许许多多的直播平台加入抢人大战，也见证过许多大主播的浮沉，直	
web	2019-10-15 15:25:00	http://ah.people.com.cn/GB/n2/2019/1015/c375162-33	人民网	传达学习全省中央扫黑除恶督导反馈问题整改专题调度会精神，听取有关文件精神的汇报、研究部署殡葬领域突出	
app	2019-10-15 15:10:28	https://c.m.163.com/news/a/ERHO8RVP05503958.html	新华网客户端新闻	2019世界智能制造大会将于10月17-19日在南京国际博览中心举行。大会期间，首届“金砖国家智能制	
web	2019-10-15 16:10:00	http://www.cenxi.gov.cn/info.php?id=174489	岑溪市人民政府门户网站	神经外科手术头架系统公开招标文件预公示各有关供应商：我广西鸿业建设工程管理咨询有限公司受招标人岑溪市	
web	2019-10-14 01:55:44	http://www.1230797.com/a/zonghexinwen/2019/1014/21	家具网	新华社北京7月27日电特朗普扬言报复数字税成美法关系分水岭？新华社记者刘阳美国总统特朗普26日威胁说	
web	2019-10-14 10:46:06	http://www.ynljys.gov.cn/xwzx/zwyw/201910/t2019101	永胜县人民政府网	中央、省委省政府环境保护督察及中央环境保护“回头看”反馈问题整改落实情况如何？整改工作该怎样继续推进	
web	2019-10-15 02:27:06	http://www.zgdtcy.com/qgb5d/h5w5n171.html	低碳产业网	巴基斯坦可持续发展政策研究所所长萨利姆?卡尔吉在接受新华社记者采访时说，中国的改革开放政策让海南经济	
web	2019-10-15 12:21:00	http://auto.0551ren.com/news/storys_136980.html	合肥人网	10月14日，由新品牌与上海俞丽拿小提琴艺术基金联合出品的音乐剧场举办媒体见面会，宣布全国三地巡演正	
web	2019-10-14 23:36:58	http://www.sohu.com/a/347009248_120205658	发现达日	陈希在青海调研“不忘初心、牢记使命”主题教育时强调切实把党中央关于主题教育的各项要求落到实处中共中央	
web	2019-10-15 16:23:56	http://www.zgdtcy.com/pxo/qtk121.html	低碳产业网	记者从长沙市教育局获悉，今年长沙市将在全市范围内开展无证办学和违规办学专项治理，重点查处无证办学行为	
web	2019-10-15 09:05:14	https://fs.leju.com/news/2019-10-15/09056589677386	乐居购房网	??乐居买房讯9月20日，佛山市人民政府发布关于印发佛山市人口发展规划的通知，阐述了佛山人口现状、存	
web	2019-10-15 23:40:03	http://www.sohu.com/a/347238117_115239	国际在线	2019中国海洋经济博览会在深圳举行国际在线报道：10月15日，有“中国海洋第一展”之称的2019中	
app	2019-10-14 18:41:16	https://c.m.163.com/news/a/ERFI3IVQ0519C6T9.html	中新经纬	中新经纬客户端10月14日电今天，你有没有被易车的广告刷屏？20个小时不间断播放的广告不仅屏霸了各大	
wx	2019-10-15 07:56:59	http://mp.weixin.qq.com/s?__biz=Mzg5ODIyNjcxNg==&m	A民声热点爆料	"国家广电总局一纸通告,又在整个娱乐圈掀起了一场大地震。有关部门同时开展的严打天价片酬行动,让整个娱乐"	
web	2019-10-14 09:42:00	http://sn.people.com.cn/n2/2019/1014/c393584-33432	人民网	西北农林科技大学按照国务院扶贫办、教育部脱贫攻坚决策部署，确立了“发挥优势、广泛动员、科技支撑、产业	
web	2019-10-14 15:18:21	http://k.sina.com.cn/article_2090512390_7c9ab00602	北青网	央视网消息：近日，国家一级重点保护鸟类——黑鹳，现身云南南涧县漫害山国有林区澜沧江边，据监测人员对黑	
web	2019-10-15 09:17:46	http://www.sohu.com/a/347061218_100290506	时尚风行派	大忙人肖战终于要开始自己的活动了，这一段时间的在节目采访中的更是透露了自己的心声。首次谈论自己的一夜	
web	2019-10-16 01:33:00	http://www.htsslt.com/html/20191016/11936.html	俄罗斯世界杯盘口	央视网消息：国务院总理李克强1日在人民大会堂会见巴西总统特梅尔。李克强表示，中巴都是发展中大国和重要	
web	2019-10-14 07:09:00	http://hb.people.com.cn/n2/2019/1014/c194063-33430	人民网湖北栏目	应尼泊尔总统班达里邀请，国家主席习近平10月12日至13日对尼泊尔进行国事访问。这是习近平主席首次访	
web	2019-10-14 17:03:00	http://ex.cssn.cn/zx/shwx/shhnew/201910/t20191014_	中国社会科学网	"内容摘要：2019中国国际数字经济博览会于10月11日至13日在河北正定举行,在这个国家级展会上,一"	
