news_media	news_posttime	news_url	app_name	news_digest	tag
app	2019-10-14 16:03:40	http://www.toutiao.com/item/6747566366271734275	日报天天看	普京访沙特有玄机中东格局加速演变俄罗斯总统普京14日访问沙特阿拉伯，与沙特领导人讨论双边合作以及地区	
wx	2019-10-15 11:35:09	http://mp.weixin.qq.com/s?__biz=MzI1NTAzMDEyMA==&m	信仰的力量61	"1953年,中南海。5月的一天,中央警卫师政委张廷桢通知我说:“汪东兴同志有事找你,你上午去中南海。"	
web	2019-10-15 08:06:00	https://mini.eastday.com/a/191015080622929.html	人民网	粮食是如何起源的？扇车、石磨等古代粮食加工工具都是干什么用的？明清时代北京城的老粮店、老酒馆是什么样	
web	2019-10-14 08:55:55	http://czj.jc.gansu.gov.cn/art/2019/10/14/art_62_5	甘肃省人民政府	10月13日，市人大常委会主任常守远到帮扶联系点永昌县六坝镇调研脱贫攻坚工作，走访慰问联系户。常守远	
app	2019-10-15 17:57:01	https://static.nfapp.southcn.com/content/201910/15	南方Plus	每天3分钟，速览全国法治新闻10月15日星期二，农历九月十七封面新闻组织独立公投，西班牙独立派领导人	
wx	2019-10-14 22:14:13	http://mp.weixin.qq.com/s?__biz=MzAwNTEwMTA4Mg==&m	华软党员e家	"◆小到个人,大到拥有9000多万党员的执政大党,任何时候都需要进行“自我革命”。开展党内集中教育是党"	
app	2019-10-14 16:48:00	http://3g.k.sohu.com/t/n399594160	搜狐新闻	杨帆80后知名经纪人，制片人。曾经合作过多名一线艺人，12-13年环球群星金牌经纪人，公认为业内最具	
app	2019-10-14 13:44:00	http://3g.k.sohu.com/t/n399544623	搜狐新闻	习近平致信祝贺中国少年先锋队建队70周年强调从小学先锋长大做先锋努力成长为能够担当民族复兴大任的时代	
wx	2019-10-15 18:24:41	http://mp.weixin.qq.com/s?__biz=MzIwNDg0Njc2MA==&m	南关发布	"为隆重庆祝中华人民共和国成立70周年,全景式展现新中国风雨兼程、砥砺前行的伟大历程,中央宣传部、中央"	
web	2019-10-14 11:28:19	http://www.sohu.com/a/346855194_362042	央广网	“全党全社会要重视少先队工作。”在中国少年先锋队建队70周年之际，习近平总书记以致信的形式，再一次强	
wx	2019-10-14 08:18:00	http://mp.weixin.qq.com/s?__biz=MzU5MTY4ODQyNg==&m	爱恨情歌	"一定别再吃三七了因为只要吃了,你会发现你嫌弃其他保养身体产品了,三七是唯.一可以长期服用吃的药食同源"	
web	2019-10-14 01:26:00	http://www.htsslt.com/html/20191014/21316.html	俄罗斯世界杯盘口	新华社记者“脱贫攻坚本来就是一场硬仗，而深度贫困地区脱贫攻坚是这场硬仗中的硬仗。我们务必深刻认识深度	
web	2019-10-15 07:46:34	"http://news.cnstock.com/news,yw-201910-4439113.htm"	上海证券报	⊙新华社西安10月14日电10月14日，中共中央政治局常委、国务院总理李克强在陕西西安主持召开部分省	
web	2019-10-14 16:59:07	http://gyangshuiming.cn/jjsz/2019/10/14/987326.htm	高密新闻网	向梦想出发！习近平发出八句青春之约国家的希望在青年，民族的未来在青年。“无论过去、现在还是未来，中国	
web	2019-10-14 00:27:00	http://women.80end.cn/DAa5qcl47473.html	芭厘时尚网	真钱棋牌游戏官网：你的3G杀手级应用是什么?你是怎么赚钱的?看看你提供的可视电话。俄罗斯科学院院长奥	
app	2019-10-14 08:22:47	http://k.sina.cn/article_1645705403_621778bb02000i	国际在线	新华社加德满都10月13日电2019年10月11日至13日，国家主席习近平应邀赴印度出席中印领导人第	
app	2019-10-15 14:54:29	http://www.toutiao.com/item/6747919623091388940	人民日报	习近平致信祝贺2019中国海洋经济博览会开幕2019中国海洋经济博览会开幕之际，中共中央总书记、国家	
app	2019-10-14 09:29:00	https://kuaibao.qq.com/s/20191014A06BBX00	人民网时政	习近平总书记在2019年秋季学期中央党校中青年干部培训班开班式上的重要讲话中指出，“广大干部特别是年	
web	2019-10-14 08:15:13	http://www.xiuning.gov.cn/News/show/8075783.html	休宁县人民政府	主题教育，不落一人。近日，渭桥乡党委结合“不忘初心、牢记使命”主题教育，开展“送学上门”到上前村扶贫	
app	2019-10-15 05:40:43	http://dw.chinanews.com/chinanews/content.jsp?id=8	中国新闻网	俄总统新闻秘书：俄罗斯与土耳其就叙利亚局势保持沟通新华社莫斯科10月14日电俄罗斯总统新闻秘书佩斯科	
app	2019-10-14 08:57:58	http://www.toutiao.com/item/6747456666406486541	投资界	投资界24h｜1000家7-11便利店将关闭，小米抢食大家电，e签宝获蚂蚁金服1亿美元C轮融资延伸阅	
wx	2019-10-14 18:20:05	http://mp.weixin.qq.com/s?__biz=MzA3MTQ1MjEzMA==&m	珠海人社	"“不忘初心、牢记使命”主题教育启动以来,习近平总书记以深邃的历史思考、坚定的信念担当,深入调研指导,"	
weibo	2019-10-14 08:45:24	http://weibo.com/2299163722/Ibq0c2m7n?refer_flag=1	Mysteel我的钢铁网		
web	2019-10-15 07:57:46	https://www.moer.cn/articleDetails.htm?articleId=3	摩尔金融	斑马消费杨伟“茅台酒是拿来喝的，不是拿来炒的”。中秋、国庆双节前，李保芳撂下狠话，再配合敲打经销商、	
web	2019-10-15 11:09:09	http://www.sohu.com/a/347089765_117927	最高人民法院网	据媒体报道，2019年10月14日，云南省高级人民法院依法对孙小果强奸、强制侮辱妇女、故意伤害、寻衅	
wx	2019-10-14 06:30:00	http://mp.weixin.qq.com/s?__biz=MzA3OTMxODc2Mg==&m		"关注创意生活严选每天分享超乎想象的好东西?长按识别二维码进入作者:袁正,西南财经大学经济学院教授,中"	
web	2019-10-14 08:47:32	http://k.sina.com.cn/article_1683472727_6457c15702	央广网	国家市场监督管理总局11日于官网发布称，近期市场监管总局组织食品安全监督抽检粮食加工品、淀粉及淀粉制	
app	2019-10-14 09:32:53	http://www.toutiao.com/item/6747465663939346948	福州新闻网	福州至马祖、厦门至金门通桥已形成初步方案13日上午，两岸40多名专家齐聚福建福州，就福州至马祖、厦门	
app	2019-10-14 08:37:27	https://c.m.163.com/news/a/EREFH40N0514R9M0.html	人民网-人民日报	童年时父母亲相继离世，家境贫寒，生活艰难。这使我自幼能吃苦，勤奋好学。小学毕业时迎来了新中国成立，从	
app	2019-10-14 08:09:00	http://view.inews.qq.com/a/20191014A03TAD00	人民网	结合实现全体人民共同富裕和生产力快速发展两个方面，中国特色社会主义政治经济学的主线可以表述为：通过快	
web	2019-10-15 10:17:31	http://www.zgdtcy.com/bau/ckc46.html	低碳产业网	北京市规划国土委相关负责人表示，在完成计划任务过程中，全面落实产权类住房约占70%，租赁类住房约占3	
web	2019-10-14 11:57:00	http://www.ycnews.cn/guonei/p/435399.html	盐城新闻网	习近平主席对尼泊尔展开了一次历史性访问，最重要的成果是把10年前建立的“中尼世代友好的全面合作伙伴关	
web	2019-10-15 04:18:00	http://www.htsslt.com/html/20191015/41424.html	俄罗斯世界杯盘口	新华社记者“脱贫攻坚本来就是一场硬仗，而深度贫困地区脱贫攻坚是这场硬仗中的硬仗。我们务必深刻认识深度	
app	2019-10-14 06:13:24	https://c.m.163.com/news/a/ERE76D540514TTJO.html	山西日报	为方便全省广大干部群众观看展览，省委宣传部制作了网上展览馆，已在山西日报客户端、山西广播电视台客户端	
app	2019-10-14 07:14:52	http://k.sina.cn/article_2286908003_884f726302001k	人民网	光明日报，这部出版于1961年的长篇小说，堪称中国当代发行量最大的革命历史小说之一。它曾经深刻影响了	
app	2019-10-14 16:35:31	http://view.inews.qq.com/a/20191014A0HKHQ00	国际在线	希腊神话说，普罗米修斯盗天火照亮尘世。马克思说，我就是普罗米修斯！在20世纪上叶的中国，也有这样一群	
web	2019-10-14 09:30:00	http://www.yancheng.gov.cn/art/2019/10/14/art_49_3	盐城市人民政府	“新时代，农村是充满希望的田野”——市委书记戴源“四不两直”深入建湖、大丰调研农房改善工作纪实建湖县	
web	2019-10-14 18:31:00	http://www.snqianxian.gov.cn/html/xwzx/jryw/201910	乾县人民政府	10月14日下午，县长焦志鹏到我县拟新增的5户规模以上企业进行调研，并主持召开座谈会，县委常委、统战	
app	2019-10-14 08:00:00	http://kscgc.sctv.com/sctv/redian/2019/10/14/80655	四川观察	今天，评论版“治理者说”专栏，刊登题为的文章，聚焦四川省巴中市巴州区通过盘活农村土地资源，加快农村经	
web	2019-10-14 15:14:02	http://www.oubaigroup.com/oub-14-1493240.html	欧佰娱乐新闻网	日前，新一轮中美经贸高级别磋商在华盛顿结束。双方在两国元首重要共识指导下，经过坦诚、高效、建设性的讨	
web	2019-10-14 09:18:00	http://hlj.people.com.cn/n2/2019/1014/c220075-3343	人民网	记者从哈尔滨市营商环境建设监督局了解到，年初以来，哈市以提升网上政务服务能力为目标，不断加大政务数据	
web	2019-10-15 16:16:19	http://www.sohu.com/a/347180100_213778	赣南日报	9月热词——多场发布会献礼新中国成立70周年信息日报、江西日报社大江大数据研究中心通过对2019年9	
web	2019-10-14 18:56:00	https://www.jiemian.com/article/3576859.html	界面	【绘心绘语】从龙象共舞到跨越喜马拉雅的友谊，习近平这些话寄意深远	
web	2019-10-14 13:42:00	http://www.xihaiannews.com/article/4278514.html	青岛西海岸新闻网	如果在中国做个调查，估计不少人曾经的理想都是当科学家。但事实让人望而却步——做基础研究、大工程，太苦	
wx	2019-10-15 06:30:08	http://mp.weixin.qq.com/s?__biz=MzA3NTM4NTI1Mg==&m	经典音乐相集	".有多少句我爱你,最后成了对不起有多少句对不起,最后都是没关系有多少句没关系,最后说了谢谢你有多少句"	
weibo	2019-10-15 10:15:04	http://weibo.com/6045999888/IbA14FlXn?refer_flag=1	小小鸟1074汪耀		
app	2019-10-14 07:00:28	https://kuaibao.qq.com/s/20191014A037GF00	大资管	今日热点王慧文卸任美团打车法定代表人。东鹏特饮筹备IPO，2018年销售额破50亿元。汉能系持续五个	
wx	2019-10-14 08:32:19	http://mp.weixin.qq.com/s?__biz=MjM5NjA2NjcyMg==&m	山东第一医科大学	"10月13日上午,山东第一医科大学在济南泉城广场举办了“守初心担使命、服务百姓健康”大型义诊活动。知"	
web	2019-10-15 06:52:55	http://www.zgdtcy.com/ttm/czv764.html	低碳产业网	哈依姆?迪沃恩大使任MASHAV主任有11年时间，并且去过发展中世界很多地方。“美国和欧洲与以色列相	
wx	2019-10-14 13:53:32	http://mp.weixin.qq.com/s?__biz=MjM5NDQ1MDAwMg==&m	赣州富翔店	"今天的这篇内容,来自一位SUBIE,小猴子在不在。我们的征稿活动上线后,收到了不少优秀的作品,后续我"	
web	2019-10-15 14:53:52	http://dy.163.com/v2/article/detail/ERHNDTK40514E6	中国青年网	10月15日消息显示，14日，无锡市委常委会专题研究部署当前安全生产工作，市委书记李小敏主持会议，省	
app	2019-10-14 10:57:08	http://www.toutiao.com/item/6747487375795945991	光明网	三个关键词读懂习近平主席南亚行新华社加德满都10月14日电地点：从北京出发，先赴金奈，后抵加德满都。	
wx	2019-10-14 07:45:17	http://mp.weixin.qq.com/s?__biz=MzUxNTk1MjE4Mw==&m	热点吐槽君	"阅读本文前,请您先点击上面的蓝色字体“热点吐槽君”,再点击“关注”,这样您就可以继续免费收到文章了。"	
wx	2019-10-14 07:00:29	http://mp.weixin.qq.com/s?__biz=MjM5NzM3MjU1Mg==&m	期货日报	上周五期货市场多数上涨。涨幅较大的是原油、上证50、铁矿石、豆粕、沪深300;跌幅较大的是甲醇、苹果	
web	2019-10-14 11:26:37	http://www.fjsyxww.com/2019-10/14/content_924866.h	三元新闻网	“欢呼呵！歌唱呵！跳舞呵！到街上来，到广场上来，到新中国的阳光下来，庆祝我们这个最伟大的节日！”盛世	
web	2019-10-14 11:12:00	http://www.4782.cn/world/2019/1014/611158.html	今日财经	关注官方微信新华社印度金奈10月12日电2019年10月11日至12日，中国国家主席习近平同印度总理	
wx	2019-10-14 17:54:33	http://mp.weixin.qq.com/s?__biz=MzU0MjM3NzQzMw==&m	浙中微生活	浙中地区新媒体领导品牌热文资讯聚焦活动福利推广品牌商务合作:18989433698数万浙江人都在关注	
wx	2019-10-14 18:37:34	http://mp.weixin.qq.com/s?__biz=MjM5NTM0NzMyMA==&m	中国金融信息网	"来源:央视财经在电商网站上只要花几元钱,就能给朋友圈来一次“精装修”,打造各种“高端人设”。近日,记"	
app	2019-10-14 10:35:38	http://view.inews.qq.com/a/20191014A06P7D00	云南省人民检察院	"从地方探索,到人大授权试点;从调研视察听取专项报告,到积极建言推动修法……公益诉讼检察的快速发展,离"	
web	2019-10-15 15:09:28	http://www.zgdtcy.com/mf261/f6m22925.html	低碳产业网	7月7日下午5点30分左右，曲靖市富源县大河镇第一中学初二307班教室里，发生一起命案。程?采又进一	
web	2019-10-14 03:56:00	http://www.shuoshuokong.org/sskZ8Iyb/	说说大全	伯爵娱乐手机客户端:“这是一志愿服务团队自身‘输血’与‘造血’的过程?，目的是将公益事业Ρ运转形成长	
web	2019-10-14 08:01:00	http://baijiahao.baidu.com/s?id=164732471512074234	长沙晚报掌上长沙	习近平结束同印度总理第二次非正式会晤和对尼泊尔国事访问回到北京新华社北京10月13日电10月13日晚	
web	2019-10-16 10:41:00	http://www.htsslt.com/html/20191016/41772.html	俄罗斯世界杯盘口	央视网消息：国务院总理李克强1日在人民大会堂会见巴西总统特梅尔。李克强表示，中巴都是发展中大国和重要	
wx	2019-10-14 00:00:00	http://mp.weixin.qq.com/s?__biz=MzI2MzA4Mjc3NQ==&m	普敦斯365健身	"摄友孙晓波分享拉萨夜景日本神户市中心发生一起枪击命案,“山口组”68岁男子开枪打死了另一个黑帮“神户"	
web	2019-10-14 08:49:00	http://baijiahao.baidu.com/s?id=164732789548899496	人民网	叙利亚驻华大使伊马德·穆斯塔法近照。海外网付勇超摄担任叙利亚驻华大使的7年来，伊马德·穆斯塔法与中国	
web	2019-10-14 15:21:24	http://k.sina.com.cn/article_1726918143_v66eeadff0	中国青年报	最近，军网微信发了个视频“吓”到了很多网友有这样一群人他们的守坝生活是这样的↓↓↓80度楼梯单程21	
wx	2019-10-14 09:00:00	http://mp.weixin.qq.com/s?__biz=MzA5MTk3NDU0NQ==&m	占狼	"小编私人微信:zhaolinzi新华社华盛顿10月12日电美国总统特朗普11日表示,他认为美中两国已"	
web	2019-10-15 06:58:00	http://www.guang-an.gov.cn/gasrmzfw/gayw/2019-10/1	广安市人民政府	10月17日上午10点30分，市教育和体育局党组书记、局长刘贤述，党组成员刘中平，副局长龙云将做客市	
app	2019-10-15 07:13:00	https://k.sina.cn/article_1683472727_6457c15702000	央广网	用户权益频缩水消毒难以保障使用体验下降共享衣橱所涉法律问题解析□本报记者赵丽□本报实习生赵心怡服装随	
wx	2019-10-15 08:00:00	http://mp.weixin.qq.com/s?__biz=MzAxMTA3OTg2MA==&m	餐饮创业圈	"5大爆款烤蛙+13大爆款牛蛙牛蛙实战课程牛蛙肉口感老?没有核心口味竞争力?牛蛙出肉率低?大厨跑了,店"	
web	2019-10-14 08:32:02	https://www.zyjjw.cn/news/china/2019-10-14/573921.	中原经济网	新华社拉萨10月13日电中共中央政治局委员、国务院扶贫开发领导小组组长胡春华11日至13日在西藏自治	
app	2019-10-14 12:33:43	http://www.toutiao.com/item/6747512264116404748	鲁网淄博频道	淄博人千万别买！这17批次食品不合格近期，市场监管总局发布情况通告，在对粮食加工品、淀粉及淀粉制品、	
web	2019-10-14 09:20:00	http://baijiahao.baidu.com/s?id=164732971630816533	西宁晚报	新华社北京10月13日电在中国少年先锋队建队70周年之际，中共中央总书记、国家主席、中央军委主席习近	
app	2019-10-14 05:38:28	http://www.toutiao.com/item/6747405253232034308	人民网	跨越喜马拉雅的友谊人民日报10月11日，在对尼泊尔进行国事访问前夕，中国国家主席习近平在尼泊尔等三家	
web	2019-10-15 17:27:00	http://women.80end.cn/DA28e0226416.html	芭厘时尚网	"申博官网2018官方唯一：虽然广州恒大多次拒绝巴塞罗那的报价,但如果巴塞罗那直接启动违约金条款,广州"	
web	2019-10-14 08:25:00	http://politics.rmlt.com.cn/2019/1014/559073.shtml	《人民论坛》杂志社	地点：从北京出发，先赴金奈，后抵加德满都。行程安排：出席中印领导人第二次非正式会晤并对尼泊尔进行国事	
web	2019-10-14 09:54:00	http://www.bjrd.gov.cn/xwzx_1/xwkx/yfly/201910/t20	北京市人民代表大会常务委员会	10月12日，市委书记蔡奇利用一整天的时间到密云区、平谷区调研指导第二批“不忘初心、牢记使命”主题教	
wx	2019-10-14 19:02:40	http://mp.weixin.qq.com/s?__biz=MzIzNjA3NTUwNg==&m	文旅蒲县	"昨天,中央广播电视总台全新推出大型文化节目。首期以拉开帷幕,邀请经典角色“李侠”原型人物李白烈士的家"	
weibo	2019-10-14 14:40:49	http://weibo.com/1883184762/IbskrFXkm?refer_flag=1	每日商报		
web	2019-10-15 17:48:01	http://app.ahrb.com.cn/ahrb/content/201910/15/c120	安徽日报	新华社西安10月14日电10月14日，中共中央政治局常委、国务院总理李克强在陕西西安主持召开部分省政	
web	2019-10-14 08:33:40	https://new.qq.com/rain/a/20191013A0A3K4	腾讯网	新华社贝鲁特10月12日电近日，黎巴嫩男子维萨姆&middot;阿里&middot;优素福因收藏全球	
web	2019-10-14 06:37:42	https://feng.ifeng.com/c/7ql7CVsoWtC	新华网	晚霞中的正定南城门。正定古城墙创建于东晋十六国时期的352年。新华网发武志伟摄这座小城至今已有160	
app	2019-10-14 08:38:42	https://kuaibao.qq.com/s/20191014A045E800	杭州之声	新一股冷空气来袭全国多地气温骤降在冷空气的影响下北京开启“双降”模式不仅最高气温下降6℃左右还下起了	
web	2019-10-14 16:12:59	http://k.sina.com.cn/article_3215153127_bfa357e702	人民网安徽频道	“湿垃圾是指日常生活垃圾产生的容易腐烂的生物质废弃物，像剩菜剩饭、破菜叶、烂水果就属于湿垃圾。干垃圾	
app	2019-10-14 08:17:32	http://crinewsradio.smartdot.com/2019-10/14/cms481	环球资讯+	新华社北京10月13日电新华社评论员日前，新一轮中美经贸高级别磋商在华盛顿结束。双方在两国元首重要共	
app	2019-10-14 10:04:33	https://kuaibao.qq.com/s/20191014A061XT00	新闻晨报	云南网友@“李心草妈妈”10月12日发文称9月9日凌晨，她收到昆明理工大学读大二的女儿李心草落水死亡	
wx	2019-10-15 10:31:39	http://mp.weixin.qq.com/s?__biz=MzIzMzMyNDk3MQ==&m	桂平微生活	"一名90后小伙儿针对某一App购买奶粉买一送一的优惠活动,竟注册了20万个账号,利用技术漏洞“薅”走"	
web	2019-10-14 08:22:00	http://theory.people.com.cn/n1/2019/1014/c40531-31	人民网	建设现代化经济体系，是以习近平同志为核心的党中央从党和国家事业全局出发，着眼于实现“两个一百年”奋斗	
app	2019-10-15 19:25:05	http://view.inews.qq.com/a/20191015A0N5I000	宜都电视台掌上宜都	五年前，2014年10月15日，人民大会堂群英荟萃、少长咸集，既有德高望重的老作家、老艺术家，也有崭	
wx	2019-10-15 00:02:00	http://mp.weixin.qq.com/s?__biz=MzA5NDMzNDM1Ng==&m	保险大师	2019年10月15日星期二;font-size:18px;box-sizing:border-bo	
web	2019-10-14 15:04:00	http://news.jiulongw.cn/ynyw/2019-10-14/105414.htm	九龙网	字体：????浏览次数:?央视网消息：近日，国家一级重点保护鸟类——黑鹳，现身云南南涧县漫害山国有林	
app	2019-10-14 13:28:00	http://3g.k.sohu.com/t/n399548375	搜狐新闻	"让经典照进现实。10月13日,在央视综合频道播出,展示新中国70年影视经典背后荡气回肠的真实印记和时"	
web	2019-10-14 11:04:08	http://zzb.ahhn.gov.cn/YD_ReadNews.asp?newsid=9456	怀宁县人民政府	??为推动全县党员在“不忘初心、牢记使命”主题教育中理论学习有收获、思想政治受洗礼，推动学习贯彻习近	
web	2019-10-16 11:40:00	http://www.qdncg.gov.cn/xwzx/bmdt/201910/t20191016	岑巩县人民政府	近日，从农业农村部种业管理司获悉，岑巩县作为贵州省唯一的国家级杂交水稻制种基地县，再次获得中央财政2	
web	2019-10-14 09:08:11	http://cxz.gov.cn/info/1026/23422.htm	楚雄州人民政府公众信息网	连日来，牟定县委书记李绍文结合自己所学所思所悟围绕“如何守初心担使命，为什么要不忘初心、牢记使命，怎	
web	2019-10-14 03:09:00	http://www.htsslt.com/html/20191014/91986.html	俄罗斯世界杯盘口	央视网消息：十二届全国人大常委会第二十九次会议1日下午在北京人民大会堂闭幕。张德江委员长主持会议。会	
web	2019-10-15 10:46:10	http://news.iqilu.com/china/gedi/2019/1015/4360950	齐鲁网	毛同辉金秋十月，和风送爽，中国元首外交再启新程。10月11日至13日，应印度共和国总理莫迪和尼泊尔总	
wx	2019-10-14 17:30:00	http://mp.weixin.qq.com/s?__biz=MjM5NDM3Nzk0MA==&m	创业者参考	图文:人民日报、东方网-纵相新闻、观察者网、杭州交通918等版权属于原作者昨日凌晨网友@李心草妈妈发	
web	2019-10-15 08:31:04	https://k.sina.com.cn/article_1645705403_621778bb0	国际在线	伦敦时间2019年10月11日，欧美同学会第十七届“21世纪中国”论坛在英国皇家学会成功举办。全国人	
app	2019-10-14 16:31:31	http://www.toutiao.com/item/6747573545439592972	人民教育出版社	腾讯前副总裁吴军：“精英教育并不适合所有人，培养一个好孩子才是重点”教育界的朋友们对吴军博士应该不会	
web	2019-10-14 13:20:00	http://www.rmjtxw.com/news/kj/90872.html	人民交通网	2019-10-1413:20:43??来源：近日，旺链科技与IBM达成合作，正式成为IBM区块链生	
web	2019-10-15 10:06:43	http://www.zgdtcy.com/oq7/hp461.html	低碳产业网	i30N将会有两个马力输出，但现代还没有正式公布车型的技术规格，但据其他专业汽车媒体报道称，i30N	
web	2019-10-14 10:01:41	http://www.nanchong.gov.cn/news/show/0410bc27-ea29	南充市人民政府门户网站	10月12日，记者从省人社厅了解到，从9月起到11月，我省在成都、泸州、资阳3个市开展社会保险经办业	
web	2019-10-15 21:09:46	http://www.tianqinyangzhi.com/finance/987202.html	国内外最新新闻	新华社杭州10月15日电中共中央政治局委员、国务院副总理孙春兰10月14至15日在浙江调研高等教育并	
wx	2019-10-15 15:16:28	http://mp.weixin.qq.com/s?__biz=MzUxODAyMzE3NA==&m	招商证券湖州苕溪西路营业部	"1、主动配合金融机构履行客户身份识别义务为了防止他人盗用您的名义从事非法活动,防止不法分子浑水摸鱼扰"	
web	2019-10-14 13:34:00	http://sn.people.com.cn/n2/2019/1014/c190199-33433	人民网	数字经济已成为产业转型升级的重要驱动力，以及全球新一轮产业竞争的制高点。我国正积极推动互联网、大数据	
web	2019-10-14 11:46:55	http://www.dangjian.cn/djw2016sy/djw2016gjgc/20191	党建网	美防长说特朗普已下令让美军撤出叙北部地区新华社华盛顿10月13日电美国国防部长埃斯珀13日说，考虑到	
web	2019-10-14 07:13:00	http://www.xuqinlf.cn/jsh5lgb/2543338.html	徐沁龙凤时尚前沿	"&gt;&gt;&gt;stratasys股票,中国光伏行业的股票遭俄海关错扣的中国公民陆续获释，东"	
web	2019-10-14 00:29:00	http://www.cvcxs.com/keji/37232.html	津市新闻网	大赛期间还将举行人工智能技术培训、机器人技术及人才培养论坛等多个培训交流活动，新华社记者程敏摄这是1	
wx	2019-10-15 18:51:22	http://mp.weixin.qq.com/s?__biz=MzIzMDA3MjEzMg==&m	陕西工会	"10月15日上午,秦小工从“中国梦·劳动美”第八届全国职工全健排舞大赛新闻发布会上获悉,由中国职工文"	
app	2019-10-14 04:46:32	https://c.m.163.com/news/a/ERE27PVI0514TTOK.html	西安晚报	陶文铨西安交大供图在交大人朋友圈刷屏的陶文铨认真备课时的照片西安交大供图在西安交大校园里，听“网红院	
web	2019-10-14 14:54:16	http://www.jdzol.com/2019/gjgn_1014/75805.html	景德镇在线	国家主席习近平13日在加德满都同尼泊尔总理奥利会谈。两国领导人谈了些什么，一起来看看↓↓↓	
wx	2019-10-14 06:24:20	http://mp.weixin.qq.com/s?__biz=MzU1MTY5MjUzMg==&m	东鼎财富订阅号	"导读:证监会新闻发言人高莉11日表示,自2020年1月1日起,取消期货公司外资股比限制;自2020年"	
web	2019-10-15 04:31:00	http://women.80end.cn/DAgwt5i59282.html	芭厘时尚网	"香港神鹰论坛：西南极冰盖是南极洲的两座冰盖之一,体积约为2200万立方千米,横贯南极山脉将该冰盖与东"	
