news_media	news_posttime	news_url	app_name	news_digest	tag
web	2019-10-16 18:16:53	http://www.zgdtcy.com/mqk/ywq523.html	低碳产业网	根据统计，全市电信网络诈骗受害人中，年龄在30以下的占了74%。而传统认为的老年人更易受骗的情况则有	
app	2019-10-14 08:20:00	http://view.inews.qq.com/a/20191014A04AXX00	人民网国际	十月十三日，国家主席习近平在加德满都同尼泊尔总理奥利会谈。新华社记者鞠鹏摄本报加德满都10月13日电	
web	2019-10-14 17:12:35	http://www.sohu.com/a/346965907_120207613	发现宁夏	近日，银川市出台，从建立更加开放有效的人才工作和使用机制、搭建更具吸引力的人才集聚平台、提供更加精细	
app	2019-10-15 19:07:35	http://www.yidianzixun.com/article/0NUIGraF	发烧phone讯	相信大家心中都认为，目前国产手机品牌已跃居世界前列水平。而华为在许多人眼中，技术研发或许是手机领域的	
app	2019-10-15 06:30:20	http://m.news.liebao.cn/detail.html?newsid=pmK6qBF	猎豹浏览器	核心阅读2019世界VR产业大会将于10月19日至21日在南昌举办。随着去年世界VR产业大会成果的高	
web	2019-10-14 02:08:16	http://bxufangxue.cn/home/2019/10/14/985590.html	东兴新闻网	央视网消息：由两岸企业家峰会主办的2016年年会7日在厦门举行大会。中共中央政治局常委、全国政协主席	
web	2019-10-15 05:59:00	http://www.htsslt.com/html/20191015/51962.html	俄罗斯世界杯盘口	新华社记者“脱贫攻坚本来就是一场硬仗，而深度贫困地区脱贫攻坚是这场硬仗中的硬仗。我们务必深刻认识深度	
wx	2019-10-14 11:41:00	http://mp.weixin.qq.com/s?__biz=MzIxMzQyNDYxMg==&m	宁夏工商联	1952年:679亿元1978年:3679亿元1986年:突破1万亿元2000年:突破10万亿元20	
wx	2019-10-14 07:01:14	http://mp.weixin.qq.com/s?__biz=Mzg5NDA1MTMxOA==&m	每天学做佳肴菜	"前一定别再吃三七了因为吃了,你会发现你开始嫌弃其他产品了,三七是唯一可以长期服用的中草药材,它健康。"	
web	2019-10-15 07:48:00	http://hi.people.com.cn/n2/2019/1015/c231190-33434	人民网	10月14日，海南省台资企业协会在海口举行理监事成员就职典礼，向新一届会长、监事长、常务副会长等颁发	
wx	2019-10-14 11:06:15	http://mp.weixin.qq.com/s?__biz=MjM5NjM2MjA4NA==&m	学习大国	编前语10月1日出版的第19期杂志发表中共中央总书记、国家主席、中央军委主席习近平的重要文章。文章中	
wx	2019-10-14 06:00:11	http://mp.weixin.qq.com/s?__biz=MzI2MzYzNTY5NA==&m	看看河北	"容颜不老、活到106岁的民国第一夫人宋美龄,却在40岁的时候就被确诊患有早期乳腺癌,这在医疗条件极度"	
web	2019-10-14 05:07:00	http://www.xuqinlf.cn/jspj8er/2406662.html	徐沁龙凤时尚前沿	YOKA时尚网官方微信孟建柱:在全面推进依法治国中更好地肩负起实践者推动者责任，季明:四中全会描绘依	
web	2019-10-14 16:36:00	https://news.dahe.cn/2019/10-14/546443.html	大河网	人民日报客户端张枨14日，内蒙古自治区纪委监委对外发布，内蒙古民族大学党委原副书记肖剑平因涉嫌严重违	
web	2019-10-15 10:16:00	http://xj.cnr.cn/2014xjfw/2014xjfwsf/20191015/t201	央广网(中国广播网)	“一定要把机车调试好。”10月6日，五团东线连队农机合作社社长张玉民在检查机车，反复叮嘱机务人员认真	
app	2019-10-15 18:11:56	http://m.yznews.cn/p/947348.html	扬州发布	在黄河流域生态保护和高质量发展座谈会上的讲话习近平黄河是中华民族的母亲河。我一直很关心黄河流域的生态	
app	2019-10-14 10:11:00	http://3g.k.sohu.com/t/n399497282	搜狐新闻	八旬老太为何裸死街头？小卖部安全套为何屡遭黑手？一个雷雨交加的夜晚，神秘女子命丧枯树命案的背后究竟隐	
web	2019-10-14 09:22:00	http://www.chinacoal-safety.gov.cn/xw/szyw/201910/	国家煤矿安全监察局	新华社北京10月13日电10月13日晚，国家主席习近平在结束同印度总理莫迪第二次非正式会晤和对尼泊尔	
wx	2019-10-14 22:03:38	http://mp.weixin.qq.com/s?__biz=MzUyNzY1ODA2MA==&m	世界中文网	"——热烈庆祝中华人民共和国成立70周年红日东升光芒万丈,五星红旗迎风飘扬。阔步行进在新时代的康庄大道"	
wx	2019-10-14 17:27:08	http://mp.weixin.qq.com/s?__biz=MzUyMDc0ODQwOQ==&m	连云港海州区宁海商会	学习进行时在河南考察调研、视察北京香山革命纪念地、主持中央政治局会议、主持中央政治局集体学习、主持召	
wx	2019-10-14 20:17:14	http://mp.weixin.qq.com/s?__biz=MjM5ODE5MjAxOA==&m	阜南青年	"飘扬的红领巾、崇高的队礼,少先队的鲜明符号,让一代代少先队员铭记在心。10月13日,在中国少年先锋队"	
web	2019-10-14 14:01:29	http://www.cet.com.cn/fcpd/ls/zcss/2379083.shtml	中国经济新闻网	新华社北京10月11日电记者从北京市住房城乡建设委了解到，北京市开展网络房源信息“周周查”行动一年来	
web	2019-10-14 04:49:00	http://www.htsslt.com/html/20191014/91781.html	俄罗斯世界杯盘口	新华社记者“脱贫攻坚本来就是一场硬仗，而深度贫困地区脱贫攻坚是这场硬仗中的硬仗。我们务必深刻认识深度	
app	2019-10-14 08:20:00	http://3g.k.sohu.com/t/n399477604	搜狐新闻	十月十三日，国家主席习近平在加德满都同尼泊尔总理奥利会谈。新华社记者鞠鹏摄本报加德满都10月13日电	
wx	2019-10-14 10:35:26	http://mp.weixin.qq.com/s?__biz=MzIyMDQ3NTU4MQ==&m	国泰君安揭阳营业部	"导读中美谈判顺利重启,美联储非量宽式扩表,双重利好将提振市场信心摘要本周焦点:中美谈判顺利重启,美联"	
web	2019-10-16 12:47:00	http://www.chinajsb.cn/html/201910/16/5525.html	中国建设报	中华人民共和国住房和城乡建设部主管中国建设报社主办大资源平台■大数据高地小小一支笔，内藏大乾坤。从笔	
wx	2019-10-14 05:10:15	http://mp.weixin.qq.com/s?__biz=MzI4OTYzNjI2Nw==&m	史学探研	"姚蓬子与鲁迅先生算是半个老乡,蓬子老家在浙江诸暨的姚公埠,此地离绍兴仅左右百里。姚蓬子的中学生涯,便"	
app	2019-10-14 16:51:09	https://c.m.163.com/news/a/ERFBQ00R052180EQ.html	宣讲家	“我们要对中印关系把舵定向，从战略高度和长远角度规划中印关系百年大计，为中印关系发展注入强劲内生动力	
wx	2019-10-15 08:30:00	http://mp.weixin.qq.com/s?__biz=MzIxMDQzOTM3OQ==&m	每日学点家常菜	"2018年6月25日,中国最长寿者阿丽米罕·色依提,在自己家中迎来132岁生日。生于1886年6月2"	
web	2019-10-14 12:53:00	http://news.jingyannet.com/guona/8891.html	京燕网	不予治功惩罚，且假如用血液酒精浓度做为单一的入功指标，所以才须要作出这一番“微调”，其实不须要构成人	
wx	2019-10-15 09:00:00	http://mp.weixin.qq.com/s?__biz=MzIxMzEwMDU3MA==&m	西双版纳德润投资咨询	"2019年5月16日出版的第10期杂志发表了重要文章。文章9000余字,对五大发展理念“创新、协调、"	
wx	2019-10-14 00:36:46	http://mp.weixin.qq.com/s?__biz=MzUzNzQzMTA1Mw==&m	60000首歌曲	"阅读本文前,请您先点击上面的蓝色字体“60000首歌曲”,再点击“关注”,这样您就可以继续免费收到有"	
wx	2019-10-14 06:25:30	http://mp.weixin.qq.com/s?__biz=MzAxNTU0Nzg3MQ==&m	消防知识大全	2019年10月14日农历己亥年九月十六1)习近平致信祝贺中国少年先锋队建队70周年强调:从小学先锋	
web	2019-10-14 04:39:00	http://www.htsslt.com/html/20191014/91517.html	俄罗斯世界杯盘口	新华社记者“脱贫攻坚本来就是一场硬仗，而深度贫困地区脱贫攻坚是这场硬仗中的硬仗。我们务必深刻认识深度	
web	2019-10-14 08:46:00	http://ydyl.people.com.cn/n1/2019/1014/c411837-313	人民网	应尼泊尔总统班达里邀请，国家主席习近平10月12日至13日对尼泊尔进行国事访问。这是习近平主席首次访	
wx	2019-10-14 09:16:23	http://mp.weixin.qq.com/s?__biz=MjM5NTE5MTQxMg==&m	微报60秒	"点击下方收听语音版综合要闻1、无锡:高架侧翻后江苏“严打”超载,无锡钢材短途运费暴涨2、事故:无锡锡"	
app	2019-10-15 09:11:03	http://m.haijiangzx.com/article/303550	海疆在线	国家主席习近平12日至13日对尼泊尔进行国事访问。习近平表示，中国和尼泊尔山水相连、世代友好。建交6	
app	2019-10-14 16:34:06	http://www.toutiao.com/item/6747574210761064964	菏泽市成武县人民法院	河南焦作：以杀全家、活埋相威胁黑老大“大头”栽了！为充分展示扫黑除恶专项斗争阶段性成效，推动扫黑除恶	
app	2019-10-14 17:24:43	http://view.inews.qq.com/a/20191014A0JEFC00	肇庆手机台	肇庆市广播电视台官方微信主流▎权威▎责任给你不一样的新闻资讯刚刚，在16:44央视一套节目再次播出了	
web	2019-10-15 08:32:00	http://qh.people.com.cn/n2/2019/1015/c182775-33435	人民网	根据青海省“组织体系建设三年行动”安排，近日，省委组织部、省委党校联合下发通知，对省州县三级党员教育	
app	2019-10-14 07:09:00	http://3g.k.sohu.com/t/n399461648	搜狐新闻	光明日报驻华盛顿记者汤先营10月11日，美国国务卿蓬佩奥赴田纳西州的纳什维尔参加了一场宗教活动，而纳	
web	2019-10-14 13:52:00	http://www.tjjrxw.com/xwzx/show-135988.html	天津今日新闻	13日上午，两岸40多名专家齐聚福建福州，就福州至马祖、厦门至金门通桥方案等议题展开专门研讨，目前两	
wx	2019-10-14 00:00:37	http://mp.weixin.qq.com/s?__biz=MjM5OTAyNDE4Mg==&m	费县在线	"无人驾驶,真的来了!近日,国家智能网联汽车测试示范区正式揭牌,武汉发出首批无人驾驶汽车试运营牌照,这"	
app	2019-10-14 10:58:00	http://k.sina.cn/article_1784473157_6a5ce64502001f	中国新闻网	央视网消息第六届世界互联网大会将于10月20日至22日在浙江乌镇举行，其中“直通乌镇”全球互联网大赛	
wx	2019-10-14 13:53:17	http://mp.weixin.qq.com/s?__biz=MzU5Mzc0OTQ1NA==&m	浮影娱乐圈	"中央电视台有很多优秀的女主持人,比如欧阳夏丹,她出生在广西桂林,最初在上海电视台工作。自2003年进"	
app	2019-10-14 15:02:00	http://view.inews.qq.com/a/20191014A0ESTX00	人民网国际	人民网讯10月12日，为纪念中日邦交正常化47周年，响应国家开展敬老爱老助老全国十月“敬老月”活动，	
wx	2019-10-14 15:10:02	http://mp.weixin.qq.com/s?__biz=MzIxMzI0ODExNw==&m	网信南宫	"如今,很多人都在微信运动上打卡“每天走一万步”。先不说它对健康到底有没有益处,至少说明走路这件事多多"	
app	2019-10-14 08:03:00	http://3g.k.sohu.com/t/n399477348	搜狐新闻	习近平主席对尼泊尔展开了一次历史性访问，最重要的成果是把10年前建立的“中尼世代友好的全面合作伙伴关	
wx	2019-10-15 13:22:39	http://mp.weixin.qq.com/s?__biz=MzIyODY5NjA1Nw==&m	大连公交客运集团汽车三分公司	"点击上面“蓝字”关注我们!你的气质里,蕴藏着你读过的书。2019年,三分公司微信公众平台将定期为您推"	
wx	2019-10-14 08:20:00	http://mp.weixin.qq.com/s?__biz=MzU4NDU0OTcwOA==&m	日读好书	点击上方蓝字『日读好书』免费关注!日读好书;font-family:-apple-system-fo	
web	2019-10-14 17:40:00	http://baijiahao.baidu.com/s?id=164736113975841707	人民看点新媒体	11日，“2019基石药业研发论坛暨‘JITRI-基石药业联合创新中心’签约揭牌仪式”在苏州举行。论	
app	2019-10-14 10:50:04	https://wap.peopleapp.com/article/rmh8328386/rmh83	广东省人民政府	10月12日，省委常委会召开会议，传达学习习近平总书记在庆祝中华人民共和国成立70周年大会上的重要讲	
web	2019-10-15 08:35:00	http://www.mymetal.net/19/1015/08/782241F70AA294AE	我的有色金属网	⊙新华社西安10月14日电10月14日，中共中央政治局常委、国务院总理李克强在陕西西安主持召开部分省	
web	2019-10-15 05:44:00	http://baijiahao.baidu.com/s?id=164740717558809583	新浪财经	目录前言一、中国粮食安全成就粮食产量稳步增长谷物供应基本自给粮食储备能力显著增强居民健康营养状况明显	
app	2019-10-14 18:36:47	https://kuaibao.qq.com/s/20191014A0M67200	深圳微访谈	新时代改革开放再出发先行者深圳又先行新华社近日特稿分析深圳如何全面开启“先行示范区”日前发布，从“先	
app	2019-10-14 15:54:56	http://www.toutiao.com/item/6747564115109102092	中国小康网	脱胎漆器匠心独运——国家级非物质文化遗产代表性传承人丁国坤10月12日，丁国坤在家中为一件未成形的脱	
web	2019-10-14 05:31:06	http://dy.163.com/v2/article/detail/ERE4N30P0514R9	海外网	近日，中国国家主席习近平对尼泊尔进行国事访问。这是中国国家主席时隔23年再次访尼，具有重要历史意义。	
web	2019-10-14 03:33:12	http://www.kaixian.tv/gd/2019/1014/1073135.html	汉丰网	新华社加德满都10月13日电国家主席习近平13日在加德满都下榻饭店会见尼泊尔。习近平表示，普拉昌达主	
wx	2019-10-14 06:30:25	http://mp.weixin.qq.com/s?__biz=MzU5NjIyNzI2Mg==&m	同城祝福相册	"一定别再吃三七了因为只要吃了,你会发现你嫌弃其他保养身体产品了,三七是唯.一可以长期服用吃的药食同源"	
web	2019-10-14 10:00:00	http://women.80end.cn/DA0y31511635.html	芭厘时尚网	老虎城优惠活动：李克强、张德江、余正生、王岐山、张高丽参加了座谈会。研讨会由刘云山主持。一种新浪娱乐	
app	2019-10-14 10:12:57	http://www.toutiao.com/item/1647333004102659	阿荣旗检察院	新华社杭州10月11日电1991年11月6日晚，一声刺耳的枪响划破浙江省武义县的静谧夜空，浙江省武义	
app	2019-10-14 09:41:10	http://www.toutiao.com/item/6747467799662166532	东光县人民检察院	把准主题教育“四字诀”党建网微平台习近平总书记在河南考察时就抓好第二批主题教育强调，要注重分类指导，	
app	2019-10-14 06:40:00	https://ie.bjd.com.cn:443/5b165687a010550e5ddc0e6a	北京日报	日前，中央纪委国家监委公开曝光六起涉黑腐败和“保护伞”典型案例。10月9日的央视新闻联播，也对这几起	
app	2019-10-14 08:01:51	http://www.toutiao.com/item/6747442205264216588	人民网湖北频道	推动中美关系沿着正确轨道向前发展透过10月10日至11日在华盛顿举行的新一轮中美经贸高级别磋商，能够	
web	2019-10-14 09:24:00	http://baijiahao.baidu.com/s?id=164732994071182505	株洲网	十月十三日，国家主席习近平在加德满都同尼泊尔总理奥利会谈。新华社记者鞠鹏摄本报加德满都10月13日电	
wx	2019-10-14 07:00:08	http://mp.weixin.qq.com/s?__biz=MzU3MjY5NTI3Mw==&m	新鲜热点早知道	"一定别再吃三七了因为只要吃了,你会发现你嫌弃其他保养身体产品了,三七是唯.一可以长期服用吃的药食同源"	
wx	2019-10-15 18:13:09	http://mp.weixin.qq.com/s?__biz=MzU3MjcwNTAxNw==&m	惠州学则艺考	"1、提颧肌:10次,10秒,手辅和自行交替进行。2、半打哈欠:5次,10秒。3、喷唇:双唇紧闭,再发"	
web	2019-10-14 09:17:50	http://www.guiyang.gov.cn/zwgk/xwdt/jrgy/20191014/	贵阳市人民政府	“学习强国”APP贵阳学习平台昨日正式上线，这是贵州省第一个地市级学习平台，由中共贵阳市委宣传部主管	
wx	2019-10-14 18:03:23	http://mp.weixin.qq.com/s?__biz=MzUzOTkxOTA5OA==&m	辰星书阁	"在举世瞩目的珠海航展上,在歼10B表演“眼镜蛇机动”、“落叶飘”等绚烂特技动作博得世界关注的同时,歼"	
journal	2019-10-15 13:56:51	http://paper.cnii.com.cn/rmydb/html/2019-10/15/nw.	人民邮电报	本报讯10月14日，由工业和信息化部主办的“信息通信业高质量发展高层次专家座谈会”在北京召开，工业和	
web	2019-10-14 11:55:42	http://www.crntt.com/doc/58_1217_105568396_1_10141	中评网	2017年12月13日，在天津大学药学院实验室，中国学生和印度学生做实验。新华社中评社香港10月14	
wx	2019-10-15 09:02:45	http://mp.weixin.qq.com/s?__biz=MzU4ODgzOTk2NQ==&m	高情商先生	"/01/生活的仪式感,从一杯暖心的茶开始柴米油盐酱醋茶,生活有时候很简单。只不过有时候我们把它想的太"	
web	2019-10-14 09:16:00	http://www.tibet.cn/cn/Instant/domestic/201910/t20	中国西藏网	央广网南京10月12日消息江苏无锡税务部门借力大数据和智能信息技术，打造“税效通、税云通、税库通”智	
app	2019-10-15 09:05:57	http://www.toutiao.com/item/1647419385622532	芜湖市人民检察院	浙江省台州市人大常委会原党组成员、副主任陈祥荣涉嫌受贿一案，由浙江省监察委员会调查终结，移送检察机关	
wx	2019-10-14 08:53:44	http://mp.weixin.qq.com/s?__biz=MzU0NjE4MjIzMg==&m	廖保平之思想国	"来源:人民日报客户端云南网友@“李心草妈妈”10月12日发文,称其在昆明理工大学读大二的女儿李心草落"	
app	2019-10-14 12:38:18	http://k.sina.cn/article_2022364304_788ad49002000h	浔阳晚报	据新华社基多10月12日电厄瓜多尔总统莫雷诺12日宣布在厄首都基多市及周边地区实施宵禁和军事管制，以	
wx	2019-10-14 17:13:52	http://mp.weixin.qq.com/s?__biz=MzIyNDAyMDQ2Ng==&m	新时代金融	"点击蓝字关注我们No.1粤港澳大湾区&middot;数据10月10日,胡润研究院发布“2019胡润百"	
web	2019-10-15 04:35:00	http://www.yybnet.net/news/world/201910/9742019.ht	炉霍新闻网	土耳其发起的“和平之泉”军事行动13日进入第五天。美国国防部长马克&middot;埃斯珀说，总统唐纳	
web	2019-10-14 11:24:00	http://www.yinjiang.gov.cn/xwzx/jrsd/201910/t20191	印江县人民政府门户网站	10月13日，以“茶酒飘香?养身印江?魅力古镇”为主题的首届酒业博览会在印江县古镇开幕，并举行新闻发	
web	2019-10-14 10:12:31	http://k.sina.com.cn/article_1683472727_6457c15702	央广网	央广网北京10月14日消息据中央广播电视总台中国之声报道，今天的特别节目让我们走近“人民楷模”国家荣	
wx	2019-10-14 08:44:28	http://mp.weixin.qq.com/s?__biz=MzI2MjMxNjcyOQ==&m	腾云国际物流官网	"1)习近平致信祝贺中国少年先锋队建队70周年强调:从小学先锋长大做先锋,努力成长为能够担当民族复兴大"	
wx	2019-10-15 08:53:56	http://mp.weixin.qq.com/s?__biz=MzU4NzcyNDc0Mw==&m	天津东丽		
web	2019-10-14 10:25:12	http://www.suizhou.gov.cn/art/2019/10/14/art_9_227	随州市人民政府	10月12日，市委书记陈瑞峰主持召开市委常委会会议，传达学习省委书记蒋超良同志批示精神、文件精神、全	
web	2019-10-14 17:26:00	https://news.yxad.com/news/346933819_313745.html	广告信息	国家发改委：取消农业税每年为农民减负超1300亿元10月14日下午，国务院办公室发表白皮书。国家发改	
web	2019-10-14 10:06:00	http://www.xjkz.gov.cn/P/C/37449.htm	克孜勒苏柯尔克孜自治州人民政府	胡春华强调坚决如期攻克深度贫困堡垒中共中央政治局委员、国务院扶贫开发领导小组组长胡春华11日至13日	
app	2019-10-16 16:29:42	http://www.toutiao.com/item/6748315246747714061	枣庄市委政法委	习近平：在黄河流域生态保护和高质量发展座谈会上的讲话10月16日出版的第20期杂志将发表中共中央总书	
web	2019-10-15 13:25:18	http://edu.workercn.cn/32907/201910/15/19101513251	中工网	新华社贵阳10月15日电近年来，贵州省遵义市正安县建立新时代乡村青年农民学校，为创业农民精准配备“产	
web	2019-10-14 08:59:00	http://www.maiji.gov.cn/html/news/gszcxx/2019-10/2	麦积区人民政府	推进政协工作制度化规范化省政协主席欧阳坚在10月12日召开的市县政协工作制度化问题座谈会上强调，要认	
web	2019-10-15 15:51:20	http://news.newsxy.com/2019/1015/357542.shtml	新余新闻网	毛同辉金秋十月，和风送爽，中国元首外交再启新程。10月11日至13日，应印度共和国总理莫迪和尼泊尔总	
app	2019-10-14 14:27:47	http://www.toutiao.com/item/6747541658507674123	济宁市人民检察院	开机广告可以有，但不应被“强制观看”的霸王方式毁掉近日，江苏省消保委对7家智能电视企业进行约谈，督促	
web	2019-10-15 03:30:58	http://www.zgdtcy.com/nnh/gfy732.html	低碳产业网	阿莉莎与纽约爱乐乐团的合作始于2007年祖宾?梅塔指挥的一场音乐会，一年后，她又在乐团时任音乐总监洛	
app	2019-10-14 08:35:00	http://3g.k.sohu.com/t/n399472428	搜狐新闻	新华社北京10月13日电针对住房租赁中群众反映强烈的突出问题，100家住房租赁中介机构近日向社会作出	
wx	2019-10-14 14:02:05	http://mp.weixin.qq.com/s?__biz=MzU0NDQ5MjM5Ng==&m	今日法条	"为了防止失联本公众号请关注以下公号谢谢!推荐投稿,入群交流方式今日法条征稿启事本平台将着力打造原创投"	
wx	2019-10-14 00:00:00	http://mp.weixin.qq.com/s?__biz=MzA4MjY0NDgxMQ==&m	法律帮帮	"10日晚上6点多,江苏无锡市北环路附近一高架桥发生倒塌。事故现场有人员受伤,车辆受损。目前救援车辆已"	
web	2019-10-14 08:52:00	http://ent.people.com.cn/n1/2019/1014/c1012-313981	人民网	10月13日，歌手莫文蔚在微博分享了自己演唱会的现场视频，透露自己的演唱会成功获吉尼斯世界纪录。她发	
app	2019-10-14 09:51:01	https://wap.peopleapp.com/article/rmh8325959/rmh83	陕西省高级人民法院	为了拍摄短视频获得高点击量，5人在地铁车厢制造恐慌。记者13日从深圳市福田区人民法院了解到，该院近日	
wx	2019-10-14 07:00:00	http://mp.weixin.qq.com/s?__biz=MzU2ODYwODkwMQ==&m	华语社区PH	"移民局公布最新数字今年已有1500外国人被捕移民局周日表示,今年迄今为止,本地执法机构已逮捕了约15"	
web	2019-10-15 09:11:00	http://news.online.sh.cn/news/gb/content/2019-10/1	上海热线	地点：从北京出发，先赴金奈，后抵加德满都。行程安排：出席中印领导人第二次非正式会晤并对尼泊尔进行国事	
web	2019-10-14 08:26:00	http://www.jlcity.gov.cn/yw/xsyw/201910/t20191014_	吉林市人民政府	10月11日，吉林市川渝协会会长周仕林带领统战助力乡村振兴先进村工作队到舒兰市水曲柳镇先进村进行再对	
web	2019-10-14 04:04:00	http://www.htsslt.com/html/20191014/41554.html	俄罗斯世界杯盘口	新华社记者“脱贫攻坚本来就是一场硬仗，而深度贫困地区脱贫攻坚是这场硬仗中的硬仗。我们务必深刻认识深度	
app	2019-10-14 12:01:00	http://mini.eastday.com/app/191014120113070.html	人民网	乡村振兴，关键要发展乡村生产力。发展乡村生产力首要解决的问题，就是如何把不动的土地变成活资产。全局谋	
app	2019-10-14 11:07:24	http://3g.k.sohu.com/t/n399512367	搜狐新闻	央视网消息第六届世界互联网大会将于10月20日至22日在浙江乌镇举行，其中“直通乌镇”全球互联网大赛	
app	2019-10-14 08:21:00	http://view.inews.qq.com/a/20191014A04AY200	人民网国际	本报印度金奈10月12日电2019年10月11日至12日，中国国家主席习近平同印度总理莫迪在印度金奈	
wx	2019-10-14 11:11:08	http://mp.weixin.qq.com/s?__biz=MzIxMzMyODcwOA==&m	洛阳政协	十三届全国政协第28次双周协商座谈会10月11日在京召开。中共中央政治局常委、全国政协主席汪洋主持会	
app	2019-10-14 16:31:39	http://view.inews.qq.com/a/20191014A0GU3C00	腾讯新闻	2019年2月16日，人民日报刊发了一篇文章，题目是。人民日报是我国最为权威的媒体，陈更的事迹能够在	
web	2019-10-14 08:08:00	http://m.xijiangtv.com/e/action/ShowInfo.php?class	贵港广播电视台	新华社西安10月13日电国务委员、公安部部长赵克志11日在全国公安机关扫黑除恶专项斗争推进会上强调，	
wx	2019-10-14 08:56:27	http://mp.weixin.qq.com/s?__biz=MzU0Mjc2MzQzOQ==&m	六里山街道办事处	中华人民共和国国家勋章和国家荣誉称号颁授仪式9月29日上午10时在人民大会堂隆重举行。中共中央总书记	
app	2019-10-15 00:03:00	http://3g.k.sohu.com/t/n399680324	搜狐新闻	注册一家属于自己的成品油公司可以解决：1.合理经营：一站式办理成品油执照及危化证；2.投标入网：方便	
wx	2019-10-15 16:14:49	http://mp.weixin.qq.com/s?__biz=MjM5NDAwMzU1Ng==&m	济南市皮肤病防治院	"庆祝中华人民共和国成立70周年活动新闻中心9月26日举行第二场新闻发布会,教育部、民政部、人力资源和"	
wx	2019-10-15 11:14:10	http://mp.weixin.qq.com/s?__biz=MzAwNjQ3NDc3MA==&m	繁峙县人民检察院	来源:新华社习近平致信祝贺中国少年先锋队建队70周年强调从小学先锋长大做先锋努力成长为能够担当民族复	
web	2019-10-14 13:11:00	http://finance.eastmoney.com/a/201910141259871221.	东方财富网	土耳其13日称已占领叙利亚北部边境城镇泰勒艾卜耶徳并控制一重要路段，将继续在叙北部向前推进30多公里	
forum	2019-10-16 08:49:41	http://forum.home.news.cn/detail/142093197/1.html#	新华网论坛	明确努力打造“阳光党务”党的组织将其实施党的领导活动、加强党的建设工作的有关事务，按规定在党内或者向	
