news_media	news_posttime	news_url	app_name	news_digest	tag
app	2019-10-14 12:53:55	https://c.m.163.com/news/a/EREU5AR605346936.html	人民网新闻	人民网-人民日报海外版担负国家使命，承载城市梦想。张家口市以建设“首都水源涵养功能区”与“生态环境支	
web	2019-10-14 05:59:03	http://www.sohu.com/a/346804265_162758	光明网	应尼泊尔总统比迪亚·德维·班达里邀请，中华人民共和国主席习近平于2019年10月12日至13日对尼泊	
web	2019-10-14 10:16:46	http://k.sina.com.cn/article_1645705403_621778bb02	国际在线	本版制图：张丹峰核心阅读查获非法采砂船305艘，查扣江砂288.2万立方米，查获涉黑资产17.9亿余	
wx	2019-10-15 10:31:11	http://mp.weixin.qq.com/s?__biz=MzI0MTE5NTYzNQ==&m	沃驰投资	"?点击上方蓝字,关注“沃驰投资”财秘关注1、中国政府网:部分省政府主要负责人经济形势座谈会在陕西西安"	
web	2019-10-16 09:37:00	http://www.pidu.gov.cn/pidu/c125577/2019-10/16/con	郫都区人民政府门户网站	大?中?小项目名称印制农民实用技术培训资料二、参加比选单位条件1.比选单位须为在中华人民共和国境内注	
web	2019-10-14 10:51:00	http://www.htsslt.com/html/20191014/71917.html	俄罗斯世界杯盘口	央视网消息：国务院总理李克强1日在人民大会堂会见巴西总统特梅尔。李克强表示，中巴都是发展中大国和重要	
web	2019-10-15 15:46:40	http://news.china.com.cn/2019-10/15/content_753039	中国网北京频道	“实现'龙象共舞'是中印唯一正确选择，符合两国和两国人民根本利益。”10月11日至12日，国家主席习	
web	2019-10-15 09:31:18	http://www.zgdtcy.com/ljb/dav839.html	低碳产业网	今年4月，继世界最薄0.15毫米超薄触控玻璃之后，中建材蚌埠玻璃工业设计研究院创造了又一硕果――0.	
wx	2019-10-14 09:05:00	http://mp.weixin.qq.com/s?__biz=MzUyNzg3Mzc3Mw==&m	天天做菜妙招	"前一定别再吃三七了因为吃了,你会发现你开始嫌弃其他产品了,三七是唯一可以长期服用的中草药材,它健康。"	
web	2019-10-16 11:10:00	http://cpc.people.com.cn/n1/2019/1016/c117005-3140	人民网	本报讯10月15日，陕西省第十五届精神文明建设“五个一工程”表彰座谈会在延安市召开。省委书记胡和平作	
web	2019-10-14 07:04:00	http://baijiahao.baidu.com/s?id=164732161184897508	中国经济网	中华人民共和国和尼泊尔联合声明新华社加德满都10月13日电中华人民共和国和尼泊尔联合声明全文如下:中	
web	2019-10-15 14:36:00	http://www.sohu.com/a/347131058_100102781	政研智库	2019年9月29日上午，政研智库培训中心承办的“不忘初心牢记使命”基层团干部培训在北京顺利举办。政	
app	2019-10-14 19:51:43	http://www.toutiao.com/item/6747625137287201294	靖宇县人民检察院	靖宇县人民检察院召开“不忘初心、牢记使命”主题教育集中学习总结会10月14日，靖宇县人民检察召开“不	
wx	2019-10-14 09:00:00	http://mp.weixin.qq.com/s?__biz=MzIxOTMwNjc5NA==&m	百姓养身大道	"点击上方百姓养身大道,欢迎关注本文专家观点空军总医院中医科主任医师马建伟湖北省中医院内科主任医师涂晋"	
wx	2019-10-14 17:14:30	http://mp.weixin.qq.com/s?__biz=MzU5NzM0ODQ5MQ==&m	丹东城建集团	"国家主席习近平11日乘专机抵达金奈,应印度共和国总理莫迪邀请,出席中印领导人第二次非正式会晤。紧凑充"	
app	2019-10-14 10:42:27	http://view.inews.qq.com/a/20191014A06YWT00	国际在线	一支笔书写的“中国制造”大文章——小故事里的大情怀之一新华社北京10月14日电题：一支笔书写的“中国	
journal	2019-10-16 09:38:21	http://www.cnepaper.com/whrbs/html/2019-10/16/cont	乌海日报	这是10月13日无人机拍摄的山西省晋城市陵川县西河底镇铺上村的屋顶光伏电站。近年来，山西省晋城市积极	
wx	2019-10-14 08:00:56	http://mp.weixin.qq.com/s?__biz=Mzg3NjI0ODEyMA==&m	永州生活号	"一个43岁的女人,正常人被叫老阿姨的年纪,竟然在3个月的时间里逐渐“返老还童”?!是什么原因让她变化"	
web	2019-10-15 08:09:23	http://www.zgdtcy.com/mgg/xra93.html	低碳产业网	对此，浸会大学表示，招生原则一向是择优而录，不会与任何机构或人士合作，更不会预设“保证录取”。根据其	
web	2019-10-14 09:55:00	http://www.gxms.gov.cn/mszx/zwdt/xzdt/4789340.html	蒙山县人民政府门户网站	10月9日下午，夏宜瑶族乡召开迎接自治区脱贫攻坚大督查工作布置会和10月份脱贫攻坚工作例会。县委常委	
web	2019-10-14 08:42:09	http://www.bjsupervision.gov.cn/ttxw/201910/t20191	北京纪检监察网	新华社加德满都10月13日电国家主席习近平13日在加德满都同尼泊尔总理奥利会谈。10月13日，国家主	
web	2019-10-14 16:31:04	http://www.jiangxi.gov.cn/art/2019/10/14/art_5210_	江西省人民政府网站	中共中央政治局委员、国务院扶贫开发领导小组组长胡春华9日在京主持召开国务院扶贫开发领导小组全体会议。	
app	2019-10-14 20:46:00	http://3g.k.sohu.com/t/n399650757	搜狐新闻	当下最流行的app是什么那必须是——学习强国小伙伴有没有发现在“学习强国”里经常会遇到一个“熟人”对	
wx	2019-10-15 15:20:00	http://mp.weixin.qq.com/s?__biz=MzU2ODcyMDgyNw==&m	热血英雄	"也许这就是命中注定,从一开始的相遇就让我再也无法从你的温柔中脱身。你是那么的亲切,像温暖的阳光,轻轻"	
app	2019-10-14 10:44:00	http://3g.k.sohu.com/t/n399505928	搜狐新闻	国务院：支持在深圳开展数字货币研究与移动支付等创新应用据证券时报报道，中共中央、国务院印发关于支持深	
wx	2019-10-16 06:00:00	http://mp.weixin.qq.com/s?__biz=MzUxMzc5MjM3NQ==&m	安全ABC	"▼9月25日清晨,有读者报料,杭州城西双龙街和枫树路交叉口附近一工地,有3名工人从9楼坠落,其中一人"	
web	2019-10-14 18:38:00	http://www.yntv.cn/content/2019/10/1554_994893.htm	云视网	新华社北京10月14日电题：奋力书写中华民族新史诗——写在习近平总书记文艺工作座谈会重要讲话发表五周	
app	2019-10-14 08:36:39	http://www.toutiao.com/item/6747451124938179079	人民网山西	“奋进山西”国庆彩车巡展暨群众文化活动启动现场群众纷纷与“奋进山西”国庆彩车合影留念。本报记者王瑞瑞	
web	2019-10-15 06:21:50	http://dy.163.com/v2/article/detail/ERGQ5J82053469	人民网新闻	人民日报杜家毫我们党来自于人民，为人民而生，因人民而兴，为人民而干。不忘初心、牢记使命，首要的是弄清	
web	2019-10-14 01:16:49	http://www.slrbs.com/news/guonei/2019-10-14/106348	商洛日报社	新华社北京10月13日电专访：理性务实管理不确定性对世界有利——访澳大利亚前部长史伟立新华社记者徐海	
wx	2019-10-14 19:10:44	http://mp.weixin.qq.com/s?__biz=MzU1NDAwMjQ2Mg==&m	了然天下	"胜利的曙光就在眼前,一场世纪大战已近尾声。就在刚刚过去的周五,新一轮中美经贸高级别磋商在华盛顿宣告结"	
web	2019-10-15 03:23:58	http://hubiqing3.com.cn/fangchanloushi/2019/10/15/	侯马市人民广播电台	9月24日，汤森路透在美国费城发布本年度“引文桂冠奖”，预测18位科学家有可能获得2015年诺贝尔化	
web	2019-10-14 17:37:00	http://women.80end.cn/DAelqma61197.html	芭厘时尚网	"123快看马经历史图库：“当我退休时,我想结婚。但我希望先有个孩子。时间!预计将在下届奥运会结束后举"	
app	2019-10-14 09:10:00	https://kuaibao.qq.com/s/20191014A04OVI00	人民网	10月13日上午，铁西区在万科润园举办“随手一分受益一生”生活垃圾分类走进物业小区启动仪式。区委宣传	
web	2019-10-14 09:00:00	http://tyzx.people.cn/n1/2019/1014/c385048-3139827	人民网	70年前，中国共产党顺应大势、团结各方，开启了协商建国、共创伟业的新纪元。民盟先贤张澜等民主人士积极	
web	2019-10-14 10:42:20	http://www.pdsxww.com/news/2019-10/14/content_3554	平顶山晚报	为期两天的新一轮中美经贸高级别磋商11日在华盛顿结束。双方根据两国元首重要共识的指导，在农业、知识产	
web	2019-10-14 17:48:10	http://www.qyx.gov.cn/dy_ReadNews.asp?NewsID=6471	保定市清苑区人民政府	崔建民主持召开区委二届一百次常委会议10月14日，区委书记崔建民主持召开二届一百次常委会议。会议学习	
web	2019-10-15 09:52:00	http://www.bjrd.gov.cn:8080/xwzx_1/xwkx/yfly/20191	北京市人民代表大会常务委员会	昨天，市委书记蔡奇用一整天时间先后到怀柔科学城、雁栖湖国际会都调查研究。他强调，要深入学习贯彻习近平	
web	2019-10-16 10:40:00	http://news.ycwb.com/2019-10/16/content_30358125.h	金羊网	常州“胖哥”40岁时208斤52岁征服珠峰，54岁再战加勒比海40岁时的张建国大腹便便，跟现在的他判	
web	2019-10-14 11:21:56	http://news.ynet.com/2019/10/14/2136235t2518.html	北青网	央视网消息：庆祝人民空军成立70周年航空开放活动新闻发布会昨天在京举行。空军新闻发言人申进科介绍，空	
web	2019-10-14 15:02:04	https://feng.ifeng.com/c/7qlXrrc5isv	新华社	二、中国特色粮食安全之路中国立足本国国情、粮情，贯彻创新、协调、绿色、开放、共享的新发展理念，落实高	
web	2019-10-15 11:52:00	http://baijiahao.baidu.com/s?id=164742987919928085	最高人民法院	代表们正在视察雁塔区法院诉讼服务中心。代表们正在视察富县法院家事调解室。9月17日至20日，根据全国	
web	2019-10-14 10:26:22	http://hen.workercn.cn/32514/201910/14/19101410244	中工网	新华网郑州10月13日电10月13日，“全面依法治国论坛暨实证法学研究年会”在郑州召开。本次论坛首次	
wx	2019-10-14 13:00:00	http://mp.weixin.qq.com/s?__biz=MzIzMDkwNzgyNQ==&m	蘭亭之絮	欢迎点击上方蓝字订阅本号每天中午一点钟准时发布尽其在我&middot;成其在天—————————韩左	
web	2019-10-14 08:21:00	http://baijiahao.baidu.com/s?id=164732628128381424	新浪科技	华语网络文学24年的历史，可以划分为三个阶段。第一阶段是1995-2002年，在PC互联网早期，网络	
app	2019-10-14 11:08:05	http://www.toutiao.com/item/6747490194942853636	杭州网	“直通乌镇”全球互联网大赛赛程公布落地最高奖励千万央视网记者王甲铸第六届世界互联网大会将于10月20	
wx	2019-10-16 14:41:37	http://mp.weixin.qq.com/s?__biz=MzA5NTg0MjY0OQ==&m	哈尔滨文艺广播	"近日,部分网友突然发现自己的QQ、微信等账户无法使用。图片来源:春城晚报-开屏新闻据公安部刑事侦查局"	
wx	2019-10-14 18:50:44	http://mp.weixin.qq.com/s?__biz=MzU5NTgwMDcyMQ==&m	道林学苑	"2019年9月29日深夜23点,一只名为“沈虎”的狗狗去世后,人民日报、南京消防等官微竟然专门发微博"	
app	2019-10-14 19:36:38	https://c.m.163.com/news/a/ERFL8EVO0512B07B.html	每日经济新闻	10月14日，人民币对美元汇率中间价报7.0725，较前一交日上升2个基点。而在、离岸人民币汇率开盘	
app	2019-10-15 17:05:00	http://m.huanqiu.com/r/MV8wXzE1NTU2NTI3XzEyNThfMTU	新闻早晚报	美国总统特朗普14日表示，土耳其在叙利亚北部的军事行动对地区和平稳定构成威胁，美方因此对土耳其实施多	
wx	2019-10-14 12:27:00	http://mp.weixin.qq.com/s?__biz=MzAwMjkzMjA1OQ==&m	心情音乐相册	"一定别再吃三七了因为吃了,你会发现你开始嫌弃其他产品了,三七是唯一可以长期服用的中草药材,它健康。一"	
wx	2019-10-14 08:00:00	http://mp.weixin.qq.com/s?__biz=Mzg5MDEzMzExMw==&m	乐山焦点网	"一个43岁的女人,正常人被叫老阿姨的年纪,竟然在3个月的时间里逐渐“返老还童”?!是什么原因让她变化"	
app	2019-10-14 10:23:52	http://www.toutiao.com/item/6747478800528835080	人民网河北频道	河北省委书记、省长一周动态人民网石家庄10月14日电作为河北省最重要的领导干部，省委书记和省长的一举	
web	2019-10-15 13:50:00	http://www.rmzxb.com.cn/c/2019-10-15/2444324.shtml	人民政协报社	新华社加德满都10月15日电题：中尼合作之花盛开在喜马拉雅山新华社记者张宁周盛平国家主席习近平13日	
weibo	2019-10-14 11:46:03	http://weibo.com/2621516563/IbrbvAc1e?refer_flag=1	咸阳日报	【#中国建成首个志愿军烈士DNA数据库#】军事科学院军事医学研究院王升启团队突破了从陈旧遗骸中提取严	
wx	2019-10-14 07:00:57	http://mp.weixin.qq.com/s?__biz=MzU5MTcwMDkyOQ==&m	成功小课堂i	"容颜不老、活到106岁的民国第一夫人宋美龄,却在40岁的时候就被确诊患有早期乳腺癌,这在医疗条件极度"	
web	2019-10-16 09:28:24	http://www.tx.gov.cn/art/2019/10/16/art_1631358_38	桐乡市人民政府	劳动关系是生产关系的重要组成部分，是最基本、最重要的社会关系之一。昨天，记者从桐乡市人力社保局获悉，	
wx	2019-10-15 18:00:00	http://mp.weixin.qq.com/s?__biz=MzA4OTYwNDYxNw==&m	豫直党建	"五年来,广大文艺工作者在习近平新时代中国特色社会主义思想指引下,坚持中国特色社会主义文化发展道路,承"	
app	2019-10-16 15:50:00	http://www.toutiao.com/item/6748305014084600324	淮滨县委政法委	延安红色文化的内涵及其历史特点李宏斌延安红色文化是延安时期中国共产党领导广大人民群众，把马克思主义普	
app	2019-10-15 11:12:00	http://3g.k.sohu.com/t/n399774884	搜狐新闻	央视网消息：在2017年10月1日，西班牙加泰罗尼亚自治区议会单方面宣布所谓“独立”。时任西班牙首相	
wx	2019-10-14 07:01:08	http://mp.weixin.qq.com/s?__biz=MzU4Nzc3OTIzOQ==&m	每天学道佳肴菜	"古人云:千年一仙草,石斛有奇效。也许,你从没有听说过石斛,更不知道过铁皮石斛,但央视早就宣传过:铁皮"	
wx	2019-10-14 19:30:00	http://mp.weixin.qq.com/s?__biz=MzI2NTY4OTM3OA==&m	沁水电视台新闻中心	内容提要:1全县新时代文明实践中心建设推进会召开2我县召开创建全国文明城市专项整治行动工作会3县政协	
web	2019-10-14 06:51:00	http://www.hafirstnews.cn/world/2019/1014/77077.ht	海安新闻网	新华社华盛顿10月13日电美国国防部长埃斯珀13日说，考虑到当前土耳其在叙利亚北部军事行动的进展，美	
app	2019-10-14 13:24:46	http://www.toutiao.com/item/6747525419047584267	外滩画报	今年我取关了258个公众号，留下了这5个丨荐号2019年，微信的活跃用户达到9.38亿。不知不觉你的	
web	2019-10-14 18:43:00	http://www.shuoshuokong.org/sskonKa/4JQ5/	说说大全	当前排行榜评分:5hb老虎机平台app下载-开关电源模块-开关电源模块推荐推荐减少科研经费报销各类证	
app	2019-10-15 03:20:00	http://3g.k.sohu.com/t/n399724474	搜狐新闻	10月14日，中共中央政治局常委、国务院总理李克强在陕西西安主持召开部分省政府主要负责人经济形势座谈	
web	2019-10-14 18:24:00	http://baijiahao.baidu.com/s?id=164736395783597609	光明网	新华社北京10月14日电记者14日从在京举行的2019年“世界标准日”纪念大会上获悉，截至目前，北京	
web	2019-10-14 10:20:36	http://www.ly.gov.cn/lyzx/jrly/909123.shtml	洛阳市人民政府网	金秋时节，河洛大地生机盎然、风光无限，八方游客纷至沓来，赏古都美景、品河洛文化。12日，为期一个月的	
journal	2019-10-14 06:35:27	http://xh.xhby.net/mp3/pc/c/201910/14/c695919.html	新华日报	面对全面建成小康社会短板弱项，我们在迎难而上、拉长补强上怎么办？面对高质量发展竞争态势，我们在项目突	
wx	2019-10-14 05:00:00	http://mp.weixin.qq.com/s?__biz=MzA4Mjk3MDcyOA==&m	菌物界	"灵芝味甘甜,性平和,入于心、肝、脾、肺、肾五脏。补气养血是其主要作用,且有止咳平喘、宁心安神的功效。"	
wx	2019-10-14 10:19:05	http://mp.weixin.qq.com/s?__biz=MzU1MDA3NjkyNQ==&m	农夫三圈	"美国和中国周五就第一阶段贸易协议达成一致,原本将在下周二生效的上调对华关税举措也将暂缓实施。这份涵盖"	
wx	2019-10-14 07:00:00	http://mp.weixin.qq.com/s?__biz=MzA3OTAwMzc2MA==&m	吐槽大人云	".长按上方二维码关注荷马文摘合作请联系QQ:31312395632015年10月25日晚,科技部官网"	
wx	2019-10-14 13:09:53	http://mp.weixin.qq.com/s?__biz=MzA5NDk5MzU1OA==&m	科工图书馆	"2019年10月10日19点30分,河北辛集中学张英考副校长受邀作客石家庄新闻广播特别节目直播录制现"	
web	2019-10-14 09:22:01	http://www.yjx.gov.cn/hdjl26/20191014/1089330.html	元江县人民政府	会上，调价方案提出人代表陈述了》，介绍了元江县生猪屠宰企业的生猪屠宰加工服务成本监审报告。随后，听证	
web	2019-10-14 10:02:00	http://www.longyan.gov.cn/xw/xsqdt/201910/t2019101	龙岩市人民政府网	“革命需要我，我不能倒下！”近日，在武平县继续教育基地人民会堂开展的“礼赞新中国奋进新时代——‘我和	
app	2019-10-14 10:14:56	http://www.toutiao.com/item/6747476500963934733	中国经济周刊	人民日报钟声：推动中美关系沿着正确轨道向前发展透过10月10日至11日在华盛顿举行的新一轮中美经贸高	
wx	2019-10-14 06:17:06	http://mp.weixin.qq.com/s?__biz=MjM5NzEwMDUwMQ==&m	扬州广播电视台	"长按下方二维码下载扬帆APP大家好,我是值班女生张舒玲,今天由我为大家播报早新闻。扬州至江都双向车友"	
wx	2019-10-14 12:43:44	http://mp.weixin.qq.com/s?__biz=MzI2MjE1MTc1MA==&m	网信重庆	用手机“攒步数”逐渐成为当下的流行趋势就算不刻意攒步数日常生活当中谁也离不开行走当“走路就能赚钱”这	
web	2019-10-14 03:12:13	http://k.sina.com.cn/article_5116298586_130f4855a0	昆明日报	日前，电影4K修复版在长春市长影旧址博物馆第七摄影棚举行点映，导演李前宽、肖桂云与观众一同重回当年拍	
wx	2019-10-15 18:21:27	http://mp.weixin.qq.com/s?__biz=MzAwMTY1MzkwOA==&m	黔教关注	"图/图虫2年前……人民日报、共青团中央等微信公众号,罕见发文——,刷爆网络。这些场景你是否觉得熟悉上"	
web	2019-10-14 08:36:00	http://www.fjrd.gov.cn/ct/2-149395	福建人大网	分享到：贺?信值此中国少年先锋队建队70周年之际，我代表党中央，向全国亿万少先队员，向为党的少年儿童	
wx	2019-10-14 09:20:02	http://mp.weixin.qq.com/s?__biz=MzA5OTMzMTQ0MQ==&m	银河证券济南营业部	"头条关注新一轮中美经贸高级别磋商在华盛顿结束!新华社华盛顿10月11日电10月10日至11日,中共中"	
web	2019-10-15 05:34:49	http://www.nbhengxing.net/china/805178.html	新闻网	本报记者张红10月11日至12日，印度吹起“中国风”：应印度总理莫迪邀请，中国国家主席习近平赴印度金	
web	2019-10-14 21:27:34	http://mp.weixin.qq.com/s?src=11&timestamp=1571058	大渝爆料台	新华社华盛顿10月14日电俄罗斯总统普京14日访问沙特阿拉伯，与沙特领导人讨论双边合作以及地区热点问	
web	2019-10-15 06:06:12	http://www.cnjg.gov.cn/articleinfo_gk.aspx?id=1378	剑阁县人民政府网站	?同志们：2012年是深入实施“十二五”规划，全面贯彻落实县十一届党代会和十七届人代会精神的关键之年	
wx	2019-10-14 12:00:22	http://mp.weixin.qq.com/s?__biz=MzAwMDEyNjEwOA==&m	测试大师	"一个42岁的女人,正常人被叫老阿姨的年纪,竟然在3个月的时间里逐渐“返老还童”?!是什么原因让她变化"	
web	2019-10-14 12:42:21	http://www.sohu.com/a/346868081_115239	国际在线	10月12日，习近平主席在加德满都总统府会见尼泊尔总统班达里。10月12日，习近平主席在加德满都总统	
wx	2019-10-14 15:45:28	http://mp.weixin.qq.com/s?__biz=MzI2NjAyODY2OQ==&m	时政热点爆料	"请点击上面免费订阅本账号1964年12月,我们小分队在滇西北找矿。小分队一共8人,其中4名警卫战士每"	
web	2019-10-14 11:36:53	http://www.hebgcdy.com/hswh/system/2019/10/14/0303	河北共产党员网	为庆祝新中国成立70周年，中共上海市委党校第三次“同读一本书”活动，选择阅读)。共10个篇章，从19	
web	2019-10-14 08:19:43	http://www.fuhunews.com/v-1-605200.aspx	浮华时讯	由中国流通行业管理与思想政治工作研究会指导，传统医学发展委员会主办，北京徐友江疑难病医学研究院承办的	
web	2019-10-14 08:40:00	http://www.ziyang.gov.cn/_ziyang/detail.aspx?id=15	资阳市人民政府网	产业扶贫探新路－－我市供销社创新开展贫困村果树“产前托管”助力脱贫攻坚翠翠的绿，包裹着青青的山；青青	
web	2019-10-14 04:36:00	http://www.yaoyangwh.com/PKcaipiaoanzhuoban/201910	配资开户	1月新增信贷和社会融资规模创天量、票据融资规模显著增加等等问题，近期成为从监管到市场、机构热议的焦点	
web	2019-10-15 01:18:00	http://www.htsslt.com/html/20191015/91799.html	俄罗斯世界杯盘口	央视网消息：十二届全国人大常委会第二十九次会议1日下午在北京人民大会堂闭幕。张德江委员长主持会议。会	
web	2019-10-14 08:31:03	http://www.zgqt.zj.cn/6781956.html	青田网	五角大楼说，美军位于叙利亚北部的一座哨所11日遭到土耳其军队炮击，没有人员伤亡。土方回应说，炮击是为	
weibo	2019-10-14 10:49:52	http://weibo.com/2044263792/IbqOHErIp?refer_flag=1	成都共青团		
wx	2019-10-14 08:27:16	http://mp.weixin.qq.com/s?__biz=MjM5Njg2MzQ4Mw==&m	金元证券指定乾坤	"今日市场观点:上周五沪指震荡走高,量能有所放大,大金融与科技板块表现较佳,周末中美签订协议利好市场平"	
wx	2019-10-14 21:44:51	http://mp.weixin.qq.com/s?__biz=MzIyNzQwNTM1NQ==&m	全球福运光明尊胜宝瓶功德藏	"中尼友好合作,正在改变许多尼泊尔民众的生活。视频:苏妮莎在中国留学7年后回到尼泊尔,成为中尼合资航空"	
web	2019-10-14 13:33:00	http://energy.people.com.cn/n1/2019/1014/c71661-31	人民网	人民网北京10月13日电国家煤矿安全监察局13日上午召开新闻发布会，通报今年以来全国煤矿安全生产情况	
web	2019-10-14 05:40:05	http://www.sohu.com/a/346803238_114731	人民网	本版制图：汪哲平核心阅读家庭农场以家庭成员为主要劳动力，以家庭经营为基本经营单元，从事农业规模化、标	
web	2019-10-15 17:19:00	http://news.cyol.com/content/2019-10/15/content_18	中青在线	湖南省委书记杜家毫日前在省委理论学习中心组集体学习会上表示，要坚决贯彻落实党中央决策部署和习近平总书	
web	2019-10-14 04:12:00	http://www.htsslt.com/html/20191014/41179.html	俄罗斯世界杯盘口	央视网消息：中共中央党校1日举行2017年秋季学期开学典礼。中共中央政治局常委、中央党校校长刘云山出	
weibo	2019-10-14 10:04:48	http://weibo.com/6605299672/Ibqwpy1mU?refer_flag=1	伊拉莎哒哒	//@古月哥欠-胡歌官网:胡歌超话 #故事里的中国# 致敬前辈期待@胡歌 永不消逝的电波	
app	2019-10-14 13:56:24	http://www.toutiao.com/item/1647347062989827	海之声助听器宜兴中心	国家卫健委：全国90%以上养老院提供不同形式医疗服务人民网北京10月11日电国家卫生健康委员会于今日	
web	2019-10-14 12:25:32	http://www.hbfxh.com/Home/ShowArticle/53c0d496593a	湖北省法学会	????新华社西安10月13日电??中共中央政治局委员、中央政法委书记郭声琨11日在陕西调研时强调，	
app	2019-10-14 04:51:31	http://www.toutiao.com/item/6747393156897047054	人民法院报	赵克志：强化政治担当使命担当责任担当不断推动扫黑除恶专项斗争取得新成效赵克志在全国扫黑除恶专项斗争第	
app	2019-10-15 02:01:05	http://m.news.cctv.com/2019/10/15/ARTI4z3bqfILwSWn	央视新闻	土耳其媒体报道称，当地时间14日，土耳其和“叙利亚国民军”发起的“和平之泉”军事行动进入新一阶段，计	
wx	2019-10-14 06:00:00	http://mp.weixin.qq.com/s?__biz=MzUyMTgyNzYzMw==&m	每日婵心	"一个43岁的女人,正常人被叫老阿姨的年纪,竟然在3个月的时间里逐渐“返老还童”?!是什么原因让她变化"	
web	2019-10-14 15:47:43	http://dy.163.com/v2/article/detail/ERF83U8H0511AP	人民上海创业	如果提到新加坡，熟悉互联网经济的人士首先会想到的是它的国有资本集团淡马锡。它以从不错过中国科技和互联	
web	2019-10-14 09:48:00	http://www.yybnet.net/huainan/news/201910/9739441.	炉霍新闻网	1941年皖南事变后，他奉命转移到淮南抗日根据地。敌人封锁严重，军工生产困难重重，他因陋就简，想方设	
app	2019-10-14 09:03:47	http://www.toutiao.com/item/6747458162820907523	人民网	志愿服务，书写新时代的雷锋故事人民日报海外版柔力球项目志愿者在北京市海淀区曙光文化广场指导社区居民练	
web	2019-10-14 02:41:00	http://baijiahao.baidu.com/s?id=164730457291676093	北青网	10月12日，有家长爆料，北京常营附近一家名为金色童年摄影的门店关门，店家失联。北京青年报记者了解到	
